sample_id,location,date,quantity,pcs/m,region,0.01,0.02,0.03,0.04,0.05,0.060000000000000005,0.06999999999999999,0.08,0.09,0.09999999999999999,0.11,0.12,0.13,0.14,0.15000000000000002,0.16,0.17,0.18000000000000002,0.19,0.2,0.21000000000000002,0.22,0.23,0.24000000000000002,0.25,0.26,0.27,0.28,0.29000000000000004,0.3,0.31,0.32,0.33,0.34,0.35000000000000003,0.36000000000000004,0.37,0.38,0.39,0.4,0.41000000000000003,0.42000000000000004,0.43,0.44,0.45,0.46,0.47000000000000003,0.48000000000000004,0.49,0.5,0.51,0.52,0.53,0.54,0.55,0.56,0.5700000000000001,0.5800000000000001,0.59,0.6,0.61,0.62,0.63,0.64,0.65,0.66,0.67,0.68,0.6900000000000001,0.7000000000000001,0.7100000000000001,0.72,0.73,0.74,0.75,0.76,0.77,0.78,0.79,0.8,0.81,0.8200000000000001,0.8300000000000001,0.8400000000000001,0.85,0.86,0.87,0.88,0.89,0.9,0.91,0.92,0.93,0.9400000000000001,0.9500000000000001,0.9600000000000001,0.97,0.98,0.99,1.0,1.01,1.02,1.03,1.04,1.05,1.06,1.07,1.08,1.09,1.1,1.11,1.12,1.1300000000000001,1.1400000000000001,1.1500000000000001,1.1600000000000001,1.17,1.18,1.19,1.2,1.21,1.22,1.23,1.24,1.25,1.26,1.27,1.28,1.29,1.3,1.31,1.32,1.33,1.34,1.35,1.36,1.37,1.3800000000000001,1.3900000000000001,1.4000000000000001,1.4100000000000001,1.42,1.43,1.44,1.45,1.46,1.47,1.48,1.49,1.5,1.51,1.52,1.53,1.54,1.55,1.56,1.57,1.58,1.59,1.6,1.61,1.62,1.6300000000000001,1.6400000000000001
"('anthy', '04.05.2022')",Anthy,2022-05-04,0,0.0,Grand lac,0.37659768214859385,0.37116540559001904,0.32062289604341765,0.23135208044965797,0.1825787499122583,0.14864064483815642,0.14124995869815873,0.10271449356329329,0.11010605035818469,0.10548186783385015,0.10102493854044224,0.10367743028446792,0.08679076107526087,0.06499205741253355,0.0470223372239593,0.052705288754361715,0.052867925736533386,0.027953068395873557,0.03665653178351209,0.03422791979709275,0.035808143716527095,0.03499386380037143,0.0,0.0,0.0,0.0,0.0,0.0,0.0,0.0,0.0,0.0,0.0,0.0,0.0,0.0,0.0,0.0,0.0,0.0,0.0,0.0,0.0,0.0,0.0,0.0,0.0,0.0,0.0,0.0,0.0,0.0,0.0,0.0,0.0,0.0,0.0,0.0,0.0,0.0,0.0,0.0,0.0,0.0,0.0,0.0,0.0,0.0,0.0,0.0,0.0,0.0,0.0,0.0,0.0,0.0,0.0,0.0,0.0,0.0,0.0,0.0,0.0,0.0,0.0,0.0,0.0,0.0,0.0,0.0,0.0,0.0,0.0,0.0,0.0,0.0,0.0,0.0,0.0,0.0,0.0,0.0,0.0,0.0,0.0,0.0,0.0,0.0,0.0,0.0,0.0,0.0,0.0,0.0,0.0,0.0,0.0,0.0,0.0,0.0,0.0,0.0,0.0,0.0,0.0,0.0,0.0,0.0,0.0,0.0,0.0,0.0,0.0,0.0,0.0,0.0,0.0,0.0,0.0,0.0,0.0,0.0,0.0,0.0,0.0,0.0,0.0,0.0,0.0,0.0,0.0,0.0,0.0,0.0,0.0,0.0,0.0,0.0,0.0,0.0,0.0,0.0,0.0,0.0
"('anthy', '09.02.2022')",Anthy,2022-02-09,0,0.0,Grand lac,0.37659768214859385,0.37116540559001904,0.32062289604341765,0.23135208044965797,0.1825787499122583,0.14864064483815642,0.14124995869815873,0.10271449356329329,0.11010605035818469,0.10548186783385015,0.10102493854044224,0.10367743028446792,0.08679076107526087,0.06499205741253355,0.0470223372239593,0.052705288754361715,0.052867925736533386,0.027953068395873557,0.03665653178351209,0.03422791979709275,0.035808143716527095,0.03499386380037143,0.0,0.0,0.0,0.0,0.0,0.0,0.0,0.0,0.0,0.0,0.0,0.0,0.0,0.0,0.0,0.0,0.0,0.0,0.0,0.0,0.0,0.0,0.0,0.0,0.0,0.0,0.0,0.0,0.0,0.0,0.0,0.0,0.0,0.0,0.0,0.0,0.0,0.0,0.0,0.0,0.0,0.0,0.0,0.0,0.0,0.0,0.0,0.0,0.0,0.0,0.0,0.0,0.0,0.0,0.0,0.0,0.0,0.0,0.0,0.0,0.0,0.0,0.0,0.0,0.0,0.0,0.0,0.0,0.0,0.0,0.0,0.0,0.0,0.0,0.0,0.0,0.0,0.0,0.0,0.0,0.0,0.0,0.0,0.0,0.0,0.0,0.0,0.0,0.0,0.0,0.0,0.0,0.0,0.0,0.0,0.0,0.0,0.0,0.0,0.0,0.0,0.0,0.0,0.0,0.0,0.0,0.0,0.0,0.0,0.0,0.0,0.0,0.0,0.0,0.0,0.0,0.0,0.0,0.0,0.0,0.0,0.0,0.0,0.0,0.0,0.0,0.0,0.0,0.0,0.0,0.0,0.0,0.0,0.0,0.0,0.0,0.0,0.0,0.0,0.0,0.0,0.0
"('anthy', '20.07.2022')",Anthy,2022-07-20,0,0.0,Grand lac,0.37659768214859385,0.37116540559001904,0.32062289604341765,0.23135208044965797,0.1825787499122583,0.14864064483815642,0.14124995869815873,0.10271449356329329,0.11010605035818469,0.10548186783385015,0.10102493854044224,0.10367743028446792,0.08679076107526087,0.06499205741253355,0.0470223372239593,0.052705288754361715,0.052867925736533386,0.027953068395873557,0.03665653178351209,0.03422791979709275,0.035808143716527095,0.03499386380037143,0.0,0.0,0.0,0.0,0.0,0.0,0.0,0.0,0.0,0.0,0.0,0.0,0.0,0.0,0.0,0.0,0.0,0.0,0.0,0.0,0.0,0.0,0.0,0.0,0.0,0.0,0.0,0.0,0.0,0.0,0.0,0.0,0.0,0.0,0.0,0.0,0.0,0.0,0.0,0.0,0.0,0.0,0.0,0.0,0.0,0.0,0.0,0.0,0.0,0.0,0.0,0.0,0.0,0.0,0.0,0.0,0.0,0.0,0.0,0.0,0.0,0.0,0.0,0.0,0.0,0.0,0.0,0.0,0.0,0.0,0.0,0.0,0.0,0.0,0.0,0.0,0.0,0.0,0.0,0.0,0.0,0.0,0.0,0.0,0.0,0.0,0.0,0.0,0.0,0.0,0.0,0.0,0.0,0.0,0.0,0.0,0.0,0.0,0.0,0.0,0.0,0.0,0.0,0.0,0.0,0.0,0.0,0.0,0.0,0.0,0.0,0.0,0.0,0.0,0.0,0.0,0.0,0.0,0.0,0.0,0.0,0.0,0.0,0.0,0.0,0.0,0.0,0.0,0.0,0.0,0.0,0.0,0.0,0.0,0.0,0.0,0.0,0.0,0.0,0.0,0.0,0.0
"('anthy', '23.11.2022')",Anthy,2022-11-23,0,0.0,Grand lac,0.37659768214859385,0.37116540559001904,0.32062289604341765,0.23135208044965797,0.1825787499122583,0.14864064483815642,0.14124995869815873,0.10271449356329329,0.11010605035818469,0.10548186783385015,0.10102493854044224,0.10367743028446792,0.08679076107526087,0.06499205741253355,0.0470223372239593,0.052705288754361715,0.052867925736533386,0.027953068395873557,0.03665653178351209,0.03422791979709275,0.035808143716527095,0.03499386380037143,0.0,0.0,0.0,0.0,0.0,0.0,0.0,0.0,0.0,0.0,0.0,0.0,0.0,0.0,0.0,0.0,0.0,0.0,0.0,0.0,0.0,0.0,0.0,0.0,0.0,0.0,0.0,0.0,0.0,0.0,0.0,0.0,0.0,0.0,0.0,0.0,0.0,0.0,0.0,0.0,0.0,0.0,0.0,0.0,0.0,0.0,0.0,0.0,0.0,0.0,0.0,0.0,0.0,0.0,0.0,0.0,0.0,0.0,0.0,0.0,0.0,0.0,0.0,0.0,0.0,0.0,0.0,0.0,0.0,0.0,0.0,0.0,0.0,0.0,0.0,0.0,0.0,0.0,0.0,0.0,0.0,0.0,0.0,0.0,0.0,0.0,0.0,0.0,0.0,0.0,0.0,0.0,0.0,0.0,0.0,0.0,0.0,0.0,0.0,0.0,0.0,0.0,0.0,0.0,0.0,0.0,0.0,0.0,0.0,0.0,0.0,0.0,0.0,0.0,0.0,0.0,0.0,0.0,0.0,0.0,0.0,0.0,0.0,0.0,0.0,0.0,0.0,0.0,0.0,0.0,0.0,0.0,0.0,0.0,0.0,0.0,0.0,0.0,0.0,0.0,0.0,0.0
"('aubonne', '05.11.2022')",Aubonne,2022-11-05,0,0.0,Grand lac,0.37659768214859385,0.37116540559001904,0.32062289604341765,0.23135208044965797,0.1825787499122583,0.14864064483815642,0.14124995869815873,0.10271449356329329,0.11010605035818469,0.10548186783385015,0.10102493854044224,0.10367743028446792,0.08679076107526087,0.06499205741253355,0.0470223372239593,0.052705288754361715,0.052867925736533386,0.027953068395873557,0.03665653178351209,0.03422791979709275,0.035808143716527095,0.03499386380037143,0.0,0.0,0.0,0.0,0.0,0.0,0.0,0.0,0.0,0.0,0.0,0.0,0.0,0.0,0.0,0.0,0.0,0.0,0.0,0.0,0.0,0.0,0.0,0.0,0.0,0.0,0.0,0.0,0.0,0.0,0.0,0.0,0.0,0.0,0.0,0.0,0.0,0.0,0.0,0.0,0.0,0.0,0.0,0.0,0.0,0.0,0.0,0.0,0.0,0.0,0.0,0.0,0.0,0.0,0.0,0.0,0.0,0.0,0.0,0.0,0.0,0.0,0.0,0.0,0.0,0.0,0.0,0.0,0.0,0.0,0.0,0.0,0.0,0.0,0.0,0.0,0.0,0.0,0.0,0.0,0.0,0.0,0.0,0.0,0.0,0.0,0.0,0.0,0.0,0.0,0.0,0.0,0.0,0.0,0.0,0.0,0.0,0.0,0.0,0.0,0.0,0.0,0.0,0.0,0.0,0.0,0.0,0.0,0.0,0.0,0.0,0.0,0.0,0.0,0.0,0.0,0.0,0.0,0.0,0.0,0.0,0.0,0.0,0.0,0.0,0.0,0.0,0.0,0.0,0.0,0.0,0.0,0.0,0.0,0.0,0.0,0.0,0.0,0.0,0.0,0.0,0.0
"('aubonne', '06.02.2022')",Aubonne,2022-02-06,0,0.0,Grand lac,0.37659768214859385,0.37116540559001904,0.32062289604341765,0.23135208044965797,0.1825787499122583,0.14864064483815642,0.14124995869815873,0.10271449356329329,0.11010605035818469,0.10548186783385015,0.10102493854044224,0.10367743028446792,0.08679076107526087,0.06499205741253355,0.0470223372239593,0.052705288754361715,0.052867925736533386,0.027953068395873557,0.03665653178351209,0.03422791979709275,0.035808143716527095,0.03499386380037143,0.0,0.0,0.0,0.0,0.0,0.0,0.0,0.0,0.0,0.0,0.0,0.0,0.0,0.0,0.0,0.0,0.0,0.0,0.0,0.0,0.0,0.0,0.0,0.0,0.0,0.0,0.0,0.0,0.0,0.0,0.0,0.0,0.0,0.0,0.0,0.0,0.0,0.0,0.0,0.0,0.0,0.0,0.0,0.0,0.0,0.0,0.0,0.0,0.0,0.0,0.0,0.0,0.0,0.0,0.0,0.0,0.0,0.0,0.0,0.0,0.0,0.0,0.0,0.0,0.0,0.0,0.0,0.0,0.0,0.0,0.0,0.0,0.0,0.0,0.0,0.0,0.0,0.0,0.0,0.0,0.0,0.0,0.0,0.0,0.0,0.0,0.0,0.0,0.0,0.0,0.0,0.0,0.0,0.0,0.0,0.0,0.0,0.0,0.0,0.0,0.0,0.0,0.0,0.0,0.0,0.0,0.0,0.0,0.0,0.0,0.0,0.0,0.0,0.0,0.0,0.0,0.0,0.0,0.0,0.0,0.0,0.0,0.0,0.0,0.0,0.0,0.0,0.0,0.0,0.0,0.0,0.0,0.0,0.0,0.0,0.0,0.0,0.0,0.0,0.0,0.0,0.0
"('aubonne', '10.09.2022')",Aubonne,2022-09-10,0,0.0,Grand lac,0.37659768214859385,0.37116540559001904,0.32062289604341765,0.23135208044965797,0.1825787499122583,0.14864064483815642,0.14124995869815873,0.10271449356329329,0.11010605035818469,0.10548186783385015,0.10102493854044224,0.10367743028446792,0.08679076107526087,0.06499205741253355,0.0470223372239593,0.052705288754361715,0.052867925736533386,0.027953068395873557,0.03665653178351209,0.03422791979709275,0.035808143716527095,0.03499386380037143,0.0,0.0,0.0,0.0,0.0,0.0,0.0,0.0,0.0,0.0,0.0,0.0,0.0,0.0,0.0,0.0,0.0,0.0,0.0,0.0,0.0,0.0,0.0,0.0,0.0,0.0,0.0,0.0,0.0,0.0,0.0,0.0,0.0,0.0,0.0,0.0,0.0,0.0,0.0,0.0,0.0,0.0,0.0,0.0,0.0,0.0,0.0,0.0,0.0,0.0,0.0,0.0,0.0,0.0,0.0,0.0,0.0,0.0,0.0,0.0,0.0,0.0,0.0,0.0,0.0,0.0,0.0,0.0,0.0,0.0,0.0,0.0,0.0,0.0,0.0,0.0,0.0,0.0,0.0,0.0,0.0,0.0,0.0,0.0,0.0,0.0,0.0,0.0,0.0,0.0,0.0,0.0,0.0,0.0,0.0,0.0,0.0,0.0,0.0,0.0,0.0,0.0,0.0,0.0,0.0,0.0,0.0,0.0,0.0,0.0,0.0,0.0,0.0,0.0,0.0,0.0,0.0,0.0,0.0,0.0,0.0,0.0,0.0,0.0,0.0,0.0,0.0,0.0,0.0,0.0,0.0,0.0,0.0,0.0,0.0,0.0,0.0,0.0,0.0,0.0,0.0,0.0
"('aubonne', '14.05.2022')",Aubonne,2022-05-14,0,0.0,Grand lac,0.37659768214859385,0.37116540559001904,0.32062289604341765,0.23135208044965797,0.1825787499122583,0.14864064483815642,0.14124995869815873,0.10271449356329329,0.11010605035818469,0.10548186783385015,0.10102493854044224,0.10367743028446792,0.08679076107526087,0.06499205741253355,0.0470223372239593,0.052705288754361715,0.052867925736533386,0.027953068395873557,0.03665653178351209,0.03422791979709275,0.035808143716527095,0.03499386380037143,0.0,0.0,0.0,0.0,0.0,0.0,0.0,0.0,0.0,0.0,0.0,0.0,0.0,0.0,0.0,0.0,0.0,0.0,0.0,0.0,0.0,0.0,0.0,0.0,0.0,0.0,0.0,0.0,0.0,0.0,0.0,0.0,0.0,0.0,0.0,0.0,0.0,0.0,0.0,0.0,0.0,0.0,0.0,0.0,0.0,0.0,0.0,0.0,0.0,0.0,0.0,0.0,0.0,0.0,0.0,0.0,0.0,0.0,0.0,0.0,0.0,0.0,0.0,0.0,0.0,0.0,0.0,0.0,0.0,0.0,0.0,0.0,0.0,0.0,0.0,0.0,0.0,0.0,0.0,0.0,0.0,0.0,0.0,0.0,0.0,0.0,0.0,0.0,0.0,0.0,0.0,0.0,0.0,0.0,0.0,0.0,0.0,0.0,0.0,0.0,0.0,0.0,0.0,0.0,0.0,0.0,0.0,0.0,0.0,0.0,0.0,0.0,0.0,0.0,0.0,0.0,0.0,0.0,0.0,0.0,0.0,0.0,0.0,0.0,0.0,0.0,0.0,0.0,0.0,0.0,0.0,0.0,0.0,0.0,0.0,0.0,0.0,0.0,0.0,0.0,0.0,0.0
"('baby-plage', '02.09.2022')",Baby Plage,2022-09-02,0,0.0,Petit lac,0.25088644085149364,0.20109664452740322,0.13525726361383164,0.1406813550505297,0.1417224503310724,0.09234063936990548,0.09048022696667041,0.09470717852014171,0.06669009565900856,0.0766154517928185,0.07115533098049315,0.05300191714918148,0.050309611013413746,0.032958679243266654,0.017286157767884818,0.017316675608425754,0.017725091822240933,0.01727424322099934,0.01686463364967079,0.01643900677596853,0.017709054747084705,0.01805345514388342,0.018459564213096226,0.018217972463836194,0.019539661643931956,0.015341189087781325,0.01742113838867753,0.021351506825431202,0.019169442788193786,0.019791217058523946,0.0,0.0,0.0,0.0,0.0,0.0,0.0,0.0,0.0,0.0,0.0,0.0,0.0,0.0,0.0,0.0,0.0,0.0,0.0,0.0,0.0,0.0,0.0,0.0,0.0,0.0,0.0,0.0,0.0,0.0,0.0,0.0,0.0,0.0,0.0,0.0,0.0,0.0,0.0,0.0,0.0,0.0,0.0,0.0,0.0,0.0,0.0,0.0,0.0,0.0,0.0,0.0,0.0,0.0,0.0,0.0,0.0,0.0,0.0,0.0,0.0,0.0,0.0,0.0,0.0,0.0,0.0,0.0,0.0,0.0,0.0,0.0,0.0,0.0,0.0,0.0,0.0,0.0,0.0,0.0,0.0,0.0,0.0,0.0,0.0,0.0,0.0,0.0,0.0,0.0,0.0,0.0,0.0,0.0,0.0,0.0,0.0,0.0,0.0,0.0,0.0,0.0,0.0,0.0,0.0,0.0,0.0,0.0,0.0,0.0,0.0,0.0,0.0,0.0,0.0,0.0,0.0,0.0,0.0,0.0,0.0,0.0,0.0,0.0,0.0,0.0,0.0,0.0,0.0,0.0,0.0,0.0,0.0,0.0
"('baby-plage', '15.10.2022')",Baby Plage,2022-10-15,0,0.0,Petit lac,0.25088644085149364,0.20109664452740322,0.13525726361383164,0.1406813550505297,0.1417224503310724,0.09234063936990548,0.09048022696667041,0.09470717852014171,0.06669009565900856,0.0766154517928185,0.07115533098049315,0.05300191714918148,0.050309611013413746,0.032958679243266654,0.017286157767884818,0.017316675608425754,0.017725091822240933,0.01727424322099934,0.01686463364967079,0.01643900677596853,0.017709054747084705,0.01805345514388342,0.018459564213096226,0.018217972463836194,0.019539661643931956,0.015341189087781325,0.01742113838867753,0.021351506825431202,0.019169442788193786,0.019791217058523946,0.0,0.0,0.0,0.0,0.0,0.0,0.0,0.0,0.0,0.0,0.0,0.0,0.0,0.0,0.0,0.0,0.0,0.0,0.0,0.0,0.0,0.0,0.0,0.0,0.0,0.0,0.0,0.0,0.0,0.0,0.0,0.0,0.0,0.0,0.0,0.0,0.0,0.0,0.0,0.0,0.0,0.0,0.0,0.0,0.0,0.0,0.0,0.0,0.0,0.0,0.0,0.0,0.0,0.0,0.0,0.0,0.0,0.0,0.0,0.0,0.0,0.0,0.0,0.0,0.0,0.0,0.0,0.0,0.0,0.0,0.0,0.0,0.0,0.0,0.0,0.0,0.0,0.0,0.0,0.0,0.0,0.0,0.0,0.0,0.0,0.0,0.0,0.0,0.0,0.0,0.0,0.0,0.0,0.0,0.0,0.0,0.0,0.0,0.0,0.0,0.0,0.0,0.0,0.0,0.0,0.0,0.0,0.0,0.0,0.0,0.0,0.0,0.0,0.0,0.0,0.0,0.0,0.0,0.0,0.0,0.0,0.0,0.0,0.0,0.0,0.0,0.0,0.0,0.0,0.0,0.0,0.0,0.0,0.0
"('baby-plage', '23.04.2022')",Baby Plage,2022-04-23,0,0.0,Petit lac,0.25088644085149364,0.20109664452740322,0.13525726361383164,0.1406813550505297,0.1417224503310724,0.09234063936990548,0.09048022696667041,0.09470717852014171,0.06669009565900856,0.0766154517928185,0.07115533098049315,0.05300191714918148,0.050309611013413746,0.032958679243266654,0.017286157767884818,0.017316675608425754,0.017725091822240933,0.01727424322099934,0.01686463364967079,0.01643900677596853,0.017709054747084705,0.01805345514388342,0.018459564213096226,0.018217972463836194,0.019539661643931956,0.015341189087781325,0.01742113838867753,0.021351506825431202,0.019169442788193786,0.019791217058523946,0.0,0.0,0.0,0.0,0.0,0.0,0.0,0.0,0.0,0.0,0.0,0.0,0.0,0.0,0.0,0.0,0.0,0.0,0.0,0.0,0.0,0.0,0.0,0.0,0.0,0.0,0.0,0.0,0.0,0.0,0.0,0.0,0.0,0.0,0.0,0.0,0.0,0.0,0.0,0.0,0.0,0.0,0.0,0.0,0.0,0.0,0.0,0.0,0.0,0.0,0.0,0.0,0.0,0.0,0.0,0.0,0.0,0.0,0.0,0.0,0.0,0.0,0.0,0.0,0.0,0.0,0.0,0.0,0.0,0.0,0.0,0.0,0.0,0.0,0.0,0.0,0.0,0.0,0.0,0.0,0.0,0.0,0.0,0.0,0.0,0.0,0.0,0.0,0.0,0.0,0.0,0.0,0.0,0.0,0.0,0.0,0.0,0.0,0.0,0.0,0.0,0.0,0.0,0.0,0.0,0.0,0.0,0.0,0.0,0.0,0.0,0.0,0.0,0.0,0.0,0.0,0.0,0.0,0.0,0.0,0.0,0.0,0.0,0.0,0.0,0.0,0.0,0.0,0.0,0.0,0.0,0.0,0.0,0.0
"('crans', '06.09.2022')",Crans,2022-09-06,0,0.0,Petit lac,0.25088644085149364,0.20109664452740322,0.13525726361383164,0.1406813550505297,0.1417224503310724,0.09234063936990548,0.09048022696667041,0.09470717852014171,0.06669009565900856,0.0766154517928185,0.07115533098049315,0.05300191714918148,0.050309611013413746,0.032958679243266654,0.017286157767884818,0.017316675608425754,0.017725091822240933,0.01727424322099934,0.01686463364967079,0.01643900677596853,0.017709054747084705,0.01805345514388342,0.018459564213096226,0.018217972463836194,0.019539661643931956,0.015341189087781325,0.01742113838867753,0.021351506825431202,0.019169442788193786,0.019791217058523946,0.0,0.0,0.0,0.0,0.0,0.0,0.0,0.0,0.0,0.0,0.0,0.0,0.0,0.0,0.0,0.0,0.0,0.0,0.0,0.0,0.0,0.0,0.0,0.0,0.0,0.0,0.0,0.0,0.0,0.0,0.0,0.0,0.0,0.0,0.0,0.0,0.0,0.0,0.0,0.0,0.0,0.0,0.0,0.0,0.0,0.0,0.0,0.0,0.0,0.0,0.0,0.0,0.0,0.0,0.0,0.0,0.0,0.0,0.0,0.0,0.0,0.0,0.0,0.0,0.0,0.0,0.0,0.0,0.0,0.0,0.0,0.0,0.0,0.0,0.0,0.0,0.0,0.0,0.0,0.0,0.0,0.0,0.0,0.0,0.0,0.0,0.0,0.0,0.0,0.0,0.0,0.0,0.0,0.0,0.0,0.0,0.0,0.0,0.0,0.0,0.0,0.0,0.0,0.0,0.0,0.0,0.0,0.0,0.0,0.0,0.0,0.0,0.0,0.0,0.0,0.0,0.0,0.0,0.0,0.0,0.0,0.0,0.0,0.0,0.0,0.0,0.0,0.0,0.0,0.0,0.0,0.0,0.0,0.0
"('crans', '16.01.2022')",Crans,2022-01-16,0,0.0,Petit lac,0.25088644085149364,0.20109664452740322,0.13525726361383164,0.1406813550505297,0.1417224503310724,0.09234063936990548,0.09048022696667041,0.09470717852014171,0.06669009565900856,0.0766154517928185,0.07115533098049315,0.05300191714918148,0.050309611013413746,0.032958679243266654,0.017286157767884818,0.017316675608425754,0.017725091822240933,0.01727424322099934,0.01686463364967079,0.01643900677596853,0.017709054747084705,0.01805345514388342,0.018459564213096226,0.018217972463836194,0.019539661643931956,0.015341189087781325,0.01742113838867753,0.021351506825431202,0.019169442788193786,0.019791217058523946,0.0,0.0,0.0,0.0,0.0,0.0,0.0,0.0,0.0,0.0,0.0,0.0,0.0,0.0,0.0,0.0,0.0,0.0,0.0,0.0,0.0,0.0,0.0,0.0,0.0,0.0,0.0,0.0,0.0,0.0,0.0,0.0,0.0,0.0,0.0,0.0,0.0,0.0,0.0,0.0,0.0,0.0,0.0,0.0,0.0,0.0,0.0,0.0,0.0,0.0,0.0,0.0,0.0,0.0,0.0,0.0,0.0,0.0,0.0,0.0,0.0,0.0,0.0,0.0,0.0,0.0,0.0,0.0,0.0,0.0,0.0,0.0,0.0,0.0,0.0,0.0,0.0,0.0,0.0,0.0,0.0,0.0,0.0,0.0,0.0,0.0,0.0,0.0,0.0,0.0,0.0,0.0,0.0,0.0,0.0,0.0,0.0,0.0,0.0,0.0,0.0,0.0,0.0,0.0,0.0,0.0,0.0,0.0,0.0,0.0,0.0,0.0,0.0,0.0,0.0,0.0,0.0,0.0,0.0,0.0,0.0,0.0,0.0,0.0,0.0,0.0,0.0,0.0,0.0,0.0,0.0,0.0,0.0,0.0
"('crans', '18.05.2022')",Crans,2022-05-18,0,0.0,Petit lac,0.25088644085149364,0.20109664452740322,0.13525726361383164,0.1406813550505297,0.1417224503310724,0.09234063936990548,0.09048022696667041,0.09470717852014171,0.06669009565900856,0.0766154517928185,0.07115533098049315,0.05300191714918148,0.050309611013413746,0.032958679243266654,0.017286157767884818,0.017316675608425754,0.017725091822240933,0.01727424322099934,0.01686463364967079,0.01643900677596853,0.017709054747084705,0.01805345514388342,0.018459564213096226,0.018217972463836194,0.019539661643931956,0.015341189087781325,0.01742113838867753,0.021351506825431202,0.019169442788193786,0.019791217058523946,0.0,0.0,0.0,0.0,0.0,0.0,0.0,0.0,0.0,0.0,0.0,0.0,0.0,0.0,0.0,0.0,0.0,0.0,0.0,0.0,0.0,0.0,0.0,0.0,0.0,0.0,0.0,0.0,0.0,0.0,0.0,0.0,0.0,0.0,0.0,0.0,0.0,0.0,0.0,0.0,0.0,0.0,0.0,0.0,0.0,0.0,0.0,0.0,0.0,0.0,0.0,0.0,0.0,0.0,0.0,0.0,0.0,0.0,0.0,0.0,0.0,0.0,0.0,0.0,0.0,0.0,0.0,0.0,0.0,0.0,0.0,0.0,0.0,0.0,0.0,0.0,0.0,0.0,0.0,0.0,0.0,0.0,0.0,0.0,0.0,0.0,0.0,0.0,0.0,0.0,0.0,0.0,0.0,0.0,0.0,0.0,0.0,0.0,0.0,0.0,0.0,0.0,0.0,0.0,0.0,0.0,0.0,0.0,0.0,0.0,0.0,0.0,0.0,0.0,0.0,0.0,0.0,0.0,0.0,0.0,0.0,0.0,0.0,0.0,0.0,0.0,0.0,0.0,0.0,0.0,0.0,0.0,0.0,0.0
"('cully', '04.05.2022')",Cully,2022-05-04,0,0.0,Haut lac,0.7302797692049658,0.6999677024452676,0.6057567125840336,0.5352017498503865,0.5264214817367325,0.4340904197719102,0.42523065510491137,0.4122581083916993,0.3793644217936407,0.3500374710334708,0.34649679838981323,0.33140263491978544,0.31947746286079326,0.29411411087594663,0.27905203360764796,0.2762130034332507,0.2675156938245815,0.2359914086142253,0.23739478454494037,0.22062980721104034,0.21039339145187974,0.21093214308098443,0.1990377970561429,0.191805899057051,0.18171177988439413,0.1773815445095092,0.16558671241730544,0.15835489810784883,0.1482169954891922,0.15343383877784816,0.14196132295257216,0.14191287137647277,0.12966100164875566,0.13539463500616072,0.12822021175189932,0.12575122007672282,0.0,0.0,0.0,0.0,0.0,0.0,0.0,0.0,0.0,0.0,0.0,0.0,0.0,0.0,0.0,0.0,0.0,0.0,0.0,0.0,0.0,0.0,0.0,0.0,0.0,0.0,0.0,0.0,0.0,0.0,0.0,0.0,0.0,0.0,0.0,0.0,0.0,0.0,0.0,0.0,0.0,0.0,0.0,0.0,0.0,0.0,0.0,0.0,0.0,0.0,0.0,0.0,0.0,0.0,0.0,0.0,0.0,0.0,0.0,0.0,0.0,0.0,0.0,0.0,0.0,0.0,0.0,0.0,0.0,0.0,0.0,0.0,0.0,0.0,0.0,0.0,0.0,0.0,0.0,0.0,0.0,0.0,0.0,0.0,0.0,0.0,0.0,0.0,0.0,0.0,0.0,0.0,0.0,0.0,0.0,0.0,0.0,0.0,0.0,0.0,0.0,0.0,0.0,0.0,0.0,0.0,0.0,0.0,0.0,0.0,0.0,0.0,0.0,0.0,0.0,0.0,0.0,0.0,0.0,0.0,0.0,0.0,0.0,0.0,0.0,0.0,0.0,0.0
"('cully', '07.08.2022')",Cully,2022-08-07,0,0.0,Haut lac,0.7302797692049658,0.6999677024452676,0.6057567125840336,0.5352017498503865,0.5264214817367325,0.4340904197719102,0.42523065510491137,0.4122581083916993,0.3793644217936407,0.3500374710334708,0.34649679838981323,0.33140263491978544,0.31947746286079326,0.29411411087594663,0.27905203360764796,0.2762130034332507,0.2675156938245815,0.2359914086142253,0.23739478454494037,0.22062980721104034,0.21039339145187974,0.21093214308098443,0.1990377970561429,0.191805899057051,0.18171177988439413,0.1773815445095092,0.16558671241730544,0.15835489810784883,0.1482169954891922,0.15343383877784816,0.14196132295257216,0.14191287137647277,0.12966100164875566,0.13539463500616072,0.12822021175189932,0.12575122007672282,0.0,0.0,0.0,0.0,0.0,0.0,0.0,0.0,0.0,0.0,0.0,0.0,0.0,0.0,0.0,0.0,0.0,0.0,0.0,0.0,0.0,0.0,0.0,0.0,0.0,0.0,0.0,0.0,0.0,0.0,0.0,0.0,0.0,0.0,0.0,0.0,0.0,0.0,0.0,0.0,0.0,0.0,0.0,0.0,0.0,0.0,0.0,0.0,0.0,0.0,0.0,0.0,0.0,0.0,0.0,0.0,0.0,0.0,0.0,0.0,0.0,0.0,0.0,0.0,0.0,0.0,0.0,0.0,0.0,0.0,0.0,0.0,0.0,0.0,0.0,0.0,0.0,0.0,0.0,0.0,0.0,0.0,0.0,0.0,0.0,0.0,0.0,0.0,0.0,0.0,0.0,0.0,0.0,0.0,0.0,0.0,0.0,0.0,0.0,0.0,0.0,0.0,0.0,0.0,0.0,0.0,0.0,0.0,0.0,0.0,0.0,0.0,0.0,0.0,0.0,0.0,0.0,0.0,0.0,0.0,0.0,0.0,0.0,0.0,0.0,0.0,0.0,0.0
"('cully', '17.10.2022')",Cully,2022-10-17,0,0.0,Haut lac,0.7302797692049658,0.6999677024452676,0.6057567125840336,0.5352017498503865,0.5264214817367325,0.4340904197719102,0.42523065510491137,0.4122581083916993,0.3793644217936407,0.3500374710334708,0.34649679838981323,0.33140263491978544,0.31947746286079326,0.29411411087594663,0.27905203360764796,0.2762130034332507,0.2675156938245815,0.2359914086142253,0.23739478454494037,0.22062980721104034,0.21039339145187974,0.21093214308098443,0.1990377970561429,0.191805899057051,0.18171177988439413,0.1773815445095092,0.16558671241730544,0.15835489810784883,0.1482169954891922,0.15343383877784816,0.14196132295257216,0.14191287137647277,0.12966100164875566,0.13539463500616072,0.12822021175189932,0.12575122007672282,0.0,0.0,0.0,0.0,0.0,0.0,0.0,0.0,0.0,0.0,0.0,0.0,0.0,0.0,0.0,0.0,0.0,0.0,0.0,0.0,0.0,0.0,0.0,0.0,0.0,0.0,0.0,0.0,0.0,0.0,0.0,0.0,0.0,0.0,0.0,0.0,0.0,0.0,0.0,0.0,0.0,0.0,0.0,0.0,0.0,0.0,0.0,0.0,0.0,0.0,0.0,0.0,0.0,0.0,0.0,0.0,0.0,0.0,0.0,0.0,0.0,0.0,0.0,0.0,0.0,0.0,0.0,0.0,0.0,0.0,0.0,0.0,0.0,0.0,0.0,0.0,0.0,0.0,0.0,0.0,0.0,0.0,0.0,0.0,0.0,0.0,0.0,0.0,0.0,0.0,0.0,0.0,0.0,0.0,0.0,0.0,0.0,0.0,0.0,0.0,0.0,0.0,0.0,0.0,0.0,0.0,0.0,0.0,0.0,0.0,0.0,0.0,0.0,0.0,0.0,0.0,0.0,0.0,0.0,0.0,0.0,0.0,0.0,0.0,0.0,0.0,0.0,0.0
"('cully', '26.01.2022')",Cully,2022-01-26,0,0.0,Haut lac,0.7302797692049658,0.6999677024452676,0.6057567125840336,0.5352017498503865,0.5264214817367325,0.4340904197719102,0.42523065510491137,0.4122581083916993,0.3793644217936407,0.3500374710334708,0.34649679838981323,0.33140263491978544,0.31947746286079326,0.29411411087594663,0.27905203360764796,0.2762130034332507,0.2675156938245815,0.2359914086142253,0.23739478454494037,0.22062980721104034,0.21039339145187974,0.21093214308098443,0.1990377970561429,0.191805899057051,0.18171177988439413,0.1773815445095092,0.16558671241730544,0.15835489810784883,0.1482169954891922,0.15343383877784816,0.14196132295257216,0.14191287137647277,0.12966100164875566,0.13539463500616072,0.12822021175189932,0.12575122007672282,0.0,0.0,0.0,0.0,0.0,0.0,0.0,0.0,0.0,0.0,0.0,0.0,0.0,0.0,0.0,0.0,0.0,0.0,0.0,0.0,0.0,0.0,0.0,0.0,0.0,0.0,0.0,0.0,0.0,0.0,0.0,0.0,0.0,0.0,0.0,0.0,0.0,0.0,0.0,0.0,0.0,0.0,0.0,0.0,0.0,0.0,0.0,0.0,0.0,0.0,0.0,0.0,0.0,0.0,0.0,0.0,0.0,0.0,0.0,0.0,0.0,0.0,0.0,0.0,0.0,0.0,0.0,0.0,0.0,0.0,0.0,0.0,0.0,0.0,0.0,0.0,0.0,0.0,0.0,0.0,0.0,0.0,0.0,0.0,0.0,0.0,0.0,0.0,0.0,0.0,0.0,0.0,0.0,0.0,0.0,0.0,0.0,0.0,0.0,0.0,0.0,0.0,0.0,0.0,0.0,0.0,0.0,0.0,0.0,0.0,0.0,0.0,0.0,0.0,0.0,0.0,0.0,0.0,0.0,0.0,0.0,0.0,0.0,0.0,0.0,0.0,0.0,0.0
"('excenevex', '04.09.2022')",Excenevex,2022-09-04,0,0.0,Grand lac,0.37659768214859385,0.37116540559001904,0.32062289604341765,0.23135208044965797,0.1825787499122583,0.14864064483815642,0.14124995869815873,0.10271449356329329,0.11010605035818469,0.10548186783385015,0.10102493854044224,0.10367743028446792,0.08679076107526087,0.06499205741253355,0.0470223372239593,0.052705288754361715,0.052867925736533386,0.027953068395873557,0.03665653178351209,0.03422791979709275,0.035808143716527095,0.03499386380037143,0.0,0.0,0.0,0.0,0.0,0.0,0.0,0.0,0.0,0.0,0.0,0.0,0.0,0.0,0.0,0.0,0.0,0.0,0.0,0.0,0.0,0.0,0.0,0.0,0.0,0.0,0.0,0.0,0.0,0.0,0.0,0.0,0.0,0.0,0.0,0.0,0.0,0.0,0.0,0.0,0.0,0.0,0.0,0.0,0.0,0.0,0.0,0.0,0.0,0.0,0.0,0.0,0.0,0.0,0.0,0.0,0.0,0.0,0.0,0.0,0.0,0.0,0.0,0.0,0.0,0.0,0.0,0.0,0.0,0.0,0.0,0.0,0.0,0.0,0.0,0.0,0.0,0.0,0.0,0.0,0.0,0.0,0.0,0.0,0.0,0.0,0.0,0.0,0.0,0.0,0.0,0.0,0.0,0.0,0.0,0.0,0.0,0.0,0.0,0.0,0.0,0.0,0.0,0.0,0.0,0.0,0.0,0.0,0.0,0.0,0.0,0.0,0.0,0.0,0.0,0.0,0.0,0.0,0.0,0.0,0.0,0.0,0.0,0.0,0.0,0.0,0.0,0.0,0.0,0.0,0.0,0.0,0.0,0.0,0.0,0.0,0.0,0.0,0.0,0.0,0.0,0.0
"('excenevex', '13.02.2022')",Excenevex,2022-02-13,0,0.0,Grand lac,0.37659768214859385,0.37116540559001904,0.32062289604341765,0.23135208044965797,0.1825787499122583,0.14864064483815642,0.14124995869815873,0.10271449356329329,0.11010605035818469,0.10548186783385015,0.10102493854044224,0.10367743028446792,0.08679076107526087,0.06499205741253355,0.0470223372239593,0.052705288754361715,0.052867925736533386,0.027953068395873557,0.03665653178351209,0.03422791979709275,0.035808143716527095,0.03499386380037143,0.0,0.0,0.0,0.0,0.0,0.0,0.0,0.0,0.0,0.0,0.0,0.0,0.0,0.0,0.0,0.0,0.0,0.0,0.0,0.0,0.0,0.0,0.0,0.0,0.0,0.0,0.0,0.0,0.0,0.0,0.0,0.0,0.0,0.0,0.0,0.0,0.0,0.0,0.0,0.0,0.0,0.0,0.0,0.0,0.0,0.0,0.0,0.0,0.0,0.0,0.0,0.0,0.0,0.0,0.0,0.0,0.0,0.0,0.0,0.0,0.0,0.0,0.0,0.0,0.0,0.0,0.0,0.0,0.0,0.0,0.0,0.0,0.0,0.0,0.0,0.0,0.0,0.0,0.0,0.0,0.0,0.0,0.0,0.0,0.0,0.0,0.0,0.0,0.0,0.0,0.0,0.0,0.0,0.0,0.0,0.0,0.0,0.0,0.0,0.0,0.0,0.0,0.0,0.0,0.0,0.0,0.0,0.0,0.0,0.0,0.0,0.0,0.0,0.0,0.0,0.0,0.0,0.0,0.0,0.0,0.0,0.0,0.0,0.0,0.0,0.0,0.0,0.0,0.0,0.0,0.0,0.0,0.0,0.0,0.0,0.0,0.0,0.0,0.0,0.0,0.0,0.0
"('gland', '06.09.2022')",Gland,2022-09-06,0,0.0,Grand lac,0.37659768214859385,0.37116540559001904,0.32062289604341765,0.23135208044965797,0.1825787499122583,0.14864064483815642,0.14124995869815873,0.10271449356329329,0.11010605035818469,0.10548186783385015,0.10102493854044224,0.10367743028446792,0.08679076107526087,0.06499205741253355,0.0470223372239593,0.052705288754361715,0.052867925736533386,0.027953068395873557,0.03665653178351209,0.03422791979709275,0.035808143716527095,0.03499386380037143,0.0,0.0,0.0,0.0,0.0,0.0,0.0,0.0,0.0,0.0,0.0,0.0,0.0,0.0,0.0,0.0,0.0,0.0,0.0,0.0,0.0,0.0,0.0,0.0,0.0,0.0,0.0,0.0,0.0,0.0,0.0,0.0,0.0,0.0,0.0,0.0,0.0,0.0,0.0,0.0,0.0,0.0,0.0,0.0,0.0,0.0,0.0,0.0,0.0,0.0,0.0,0.0,0.0,0.0,0.0,0.0,0.0,0.0,0.0,0.0,0.0,0.0,0.0,0.0,0.0,0.0,0.0,0.0,0.0,0.0,0.0,0.0,0.0,0.0,0.0,0.0,0.0,0.0,0.0,0.0,0.0,0.0,0.0,0.0,0.0,0.0,0.0,0.0,0.0,0.0,0.0,0.0,0.0,0.0,0.0,0.0,0.0,0.0,0.0,0.0,0.0,0.0,0.0,0.0,0.0,0.0,0.0,0.0,0.0,0.0,0.0,0.0,0.0,0.0,0.0,0.0,0.0,0.0,0.0,0.0,0.0,0.0,0.0,0.0,0.0,0.0,0.0,0.0,0.0,0.0,0.0,0.0,0.0,0.0,0.0,0.0,0.0,0.0,0.0,0.0,0.0,0.0
"('gland', '10.12.2022')",Gland,2022-12-10,0,0.0,Grand lac,0.37659768214859385,0.37116540559001904,0.32062289604341765,0.23135208044965797,0.1825787499122583,0.14864064483815642,0.14124995869815873,0.10271449356329329,0.11010605035818469,0.10548186783385015,0.10102493854044224,0.10367743028446792,0.08679076107526087,0.06499205741253355,0.0470223372239593,0.052705288754361715,0.052867925736533386,0.027953068395873557,0.03665653178351209,0.03422791979709275,0.035808143716527095,0.03499386380037143,0.0,0.0,0.0,0.0,0.0,0.0,0.0,0.0,0.0,0.0,0.0,0.0,0.0,0.0,0.0,0.0,0.0,0.0,0.0,0.0,0.0,0.0,0.0,0.0,0.0,0.0,0.0,0.0,0.0,0.0,0.0,0.0,0.0,0.0,0.0,0.0,0.0,0.0,0.0,0.0,0.0,0.0,0.0,0.0,0.0,0.0,0.0,0.0,0.0,0.0,0.0,0.0,0.0,0.0,0.0,0.0,0.0,0.0,0.0,0.0,0.0,0.0,0.0,0.0,0.0,0.0,0.0,0.0,0.0,0.0,0.0,0.0,0.0,0.0,0.0,0.0,0.0,0.0,0.0,0.0,0.0,0.0,0.0,0.0,0.0,0.0,0.0,0.0,0.0,0.0,0.0,0.0,0.0,0.0,0.0,0.0,0.0,0.0,0.0,0.0,0.0,0.0,0.0,0.0,0.0,0.0,0.0,0.0,0.0,0.0,0.0,0.0,0.0,0.0,0.0,0.0,0.0,0.0,0.0,0.0,0.0,0.0,0.0,0.0,0.0,0.0,0.0,0.0,0.0,0.0,0.0,0.0,0.0,0.0,0.0,0.0,0.0,0.0,0.0,0.0,0.0,0.0
"('gland', '16.01.2022')",Gland,2022-01-16,0,0.0,Grand lac,0.37659768214859385,0.37116540559001904,0.32062289604341765,0.23135208044965797,0.1825787499122583,0.14864064483815642,0.14124995869815873,0.10271449356329329,0.11010605035818469,0.10548186783385015,0.10102493854044224,0.10367743028446792,0.08679076107526087,0.06499205741253355,0.0470223372239593,0.052705288754361715,0.052867925736533386,0.027953068395873557,0.03665653178351209,0.03422791979709275,0.035808143716527095,0.03499386380037143,0.0,0.0,0.0,0.0,0.0,0.0,0.0,0.0,0.0,0.0,0.0,0.0,0.0,0.0,0.0,0.0,0.0,0.0,0.0,0.0,0.0,0.0,0.0,0.0,0.0,0.0,0.0,0.0,0.0,0.0,0.0,0.0,0.0,0.0,0.0,0.0,0.0,0.0,0.0,0.0,0.0,0.0,0.0,0.0,0.0,0.0,0.0,0.0,0.0,0.0,0.0,0.0,0.0,0.0,0.0,0.0,0.0,0.0,0.0,0.0,0.0,0.0,0.0,0.0,0.0,0.0,0.0,0.0,0.0,0.0,0.0,0.0,0.0,0.0,0.0,0.0,0.0,0.0,0.0,0.0,0.0,0.0,0.0,0.0,0.0,0.0,0.0,0.0,0.0,0.0,0.0,0.0,0.0,0.0,0.0,0.0,0.0,0.0,0.0,0.0,0.0,0.0,0.0,0.0,0.0,0.0,0.0,0.0,0.0,0.0,0.0,0.0,0.0,0.0,0.0,0.0,0.0,0.0,0.0,0.0,0.0,0.0,0.0,0.0,0.0,0.0,0.0,0.0,0.0,0.0,0.0,0.0,0.0,0.0,0.0,0.0,0.0,0.0,0.0,0.0,0.0,0.0
"('gland', '18.05.2022')",Gland,2022-05-18,0,0.0,Grand lac,0.37659768214859385,0.37116540559001904,0.32062289604341765,0.23135208044965797,0.1825787499122583,0.14864064483815642,0.14124995869815873,0.10271449356329329,0.11010605035818469,0.10548186783385015,0.10102493854044224,0.10367743028446792,0.08679076107526087,0.06499205741253355,0.0470223372239593,0.052705288754361715,0.052867925736533386,0.027953068395873557,0.03665653178351209,0.03422791979709275,0.035808143716527095,0.03499386380037143,0.0,0.0,0.0,0.0,0.0,0.0,0.0,0.0,0.0,0.0,0.0,0.0,0.0,0.0,0.0,0.0,0.0,0.0,0.0,0.0,0.0,0.0,0.0,0.0,0.0,0.0,0.0,0.0,0.0,0.0,0.0,0.0,0.0,0.0,0.0,0.0,0.0,0.0,0.0,0.0,0.0,0.0,0.0,0.0,0.0,0.0,0.0,0.0,0.0,0.0,0.0,0.0,0.0,0.0,0.0,0.0,0.0,0.0,0.0,0.0,0.0,0.0,0.0,0.0,0.0,0.0,0.0,0.0,0.0,0.0,0.0,0.0,0.0,0.0,0.0,0.0,0.0,0.0,0.0,0.0,0.0,0.0,0.0,0.0,0.0,0.0,0.0,0.0,0.0,0.0,0.0,0.0,0.0,0.0,0.0,0.0,0.0,0.0,0.0,0.0,0.0,0.0,0.0,0.0,0.0,0.0,0.0,0.0,0.0,0.0,0.0,0.0,0.0,0.0,0.0,0.0,0.0,0.0,0.0,0.0,0.0,0.0,0.0,0.0,0.0,0.0,0.0,0.0,0.0,0.0,0.0,0.0,0.0,0.0,0.0,0.0,0.0,0.0,0.0,0.0,0.0,0.0
"('grangettes', '13.02.2022')",Grangettes,2022-02-13,0,0.0,Haut lac,0.7302797692049658,0.6999677024452676,0.6057567125840336,0.5352017498503865,0.5264214817367325,0.4340904197719102,0.42523065510491137,0.4122581083916993,0.3793644217936407,0.3500374710334708,0.34649679838981323,0.33140263491978544,0.31947746286079326,0.29411411087594663,0.27905203360764796,0.2762130034332507,0.2675156938245815,0.2359914086142253,0.23739478454494037,0.22062980721104034,0.21039339145187974,0.21093214308098443,0.1990377970561429,0.191805899057051,0.18171177988439413,0.1773815445095092,0.16558671241730544,0.15835489810784883,0.1482169954891922,0.15343383877784816,0.14196132295257216,0.14191287137647277,0.12966100164875566,0.13539463500616072,0.12822021175189932,0.12575122007672282,0.0,0.0,0.0,0.0,0.0,0.0,0.0,0.0,0.0,0.0,0.0,0.0,0.0,0.0,0.0,0.0,0.0,0.0,0.0,0.0,0.0,0.0,0.0,0.0,0.0,0.0,0.0,0.0,0.0,0.0,0.0,0.0,0.0,0.0,0.0,0.0,0.0,0.0,0.0,0.0,0.0,0.0,0.0,0.0,0.0,0.0,0.0,0.0,0.0,0.0,0.0,0.0,0.0,0.0,0.0,0.0,0.0,0.0,0.0,0.0,0.0,0.0,0.0,0.0,0.0,0.0,0.0,0.0,0.0,0.0,0.0,0.0,0.0,0.0,0.0,0.0,0.0,0.0,0.0,0.0,0.0,0.0,0.0,0.0,0.0,0.0,0.0,0.0,0.0,0.0,0.0,0.0,0.0,0.0,0.0,0.0,0.0,0.0,0.0,0.0,0.0,0.0,0.0,0.0,0.0,0.0,0.0,0.0,0.0,0.0,0.0,0.0,0.0,0.0,0.0,0.0,0.0,0.0,0.0,0.0,0.0,0.0,0.0,0.0,0.0,0.0,0.0,0.0
"('grangettes', '18.07.2022')",Grangettes,2022-07-18,0,0.0,Haut lac,0.7302797692049658,0.6999677024452676,0.6057567125840336,0.5352017498503865,0.5264214817367325,0.4340904197719102,0.42523065510491137,0.4122581083916993,0.3793644217936407,0.3500374710334708,0.34649679838981323,0.33140263491978544,0.31947746286079326,0.29411411087594663,0.27905203360764796,0.2762130034332507,0.2675156938245815,0.2359914086142253,0.23739478454494037,0.22062980721104034,0.21039339145187974,0.21093214308098443,0.1990377970561429,0.191805899057051,0.18171177988439413,0.1773815445095092,0.16558671241730544,0.15835489810784883,0.1482169954891922,0.15343383877784816,0.14196132295257216,0.14191287137647277,0.12966100164875566,0.13539463500616072,0.12822021175189932,0.12575122007672282,0.0,0.0,0.0,0.0,0.0,0.0,0.0,0.0,0.0,0.0,0.0,0.0,0.0,0.0,0.0,0.0,0.0,0.0,0.0,0.0,0.0,0.0,0.0,0.0,0.0,0.0,0.0,0.0,0.0,0.0,0.0,0.0,0.0,0.0,0.0,0.0,0.0,0.0,0.0,0.0,0.0,0.0,0.0,0.0,0.0,0.0,0.0,0.0,0.0,0.0,0.0,0.0,0.0,0.0,0.0,0.0,0.0,0.0,0.0,0.0,0.0,0.0,0.0,0.0,0.0,0.0,0.0,0.0,0.0,0.0,0.0,0.0,0.0,0.0,0.0,0.0,0.0,0.0,0.0,0.0,0.0,0.0,0.0,0.0,0.0,0.0,0.0,0.0,0.0,0.0,0.0,0.0,0.0,0.0,0.0,0.0,0.0,0.0,0.0,0.0,0.0,0.0,0.0,0.0,0.0,0.0,0.0,0.0,0.0,0.0,0.0,0.0,0.0,0.0,0.0,0.0,0.0,0.0,0.0,0.0,0.0,0.0,0.0,0.0,0.0,0.0,0.0,0.0
"('hermance', '10.01.2022')",Hermance,2022-01-10,0,0.0,Petit lac,0.25088644085149364,0.20109664452740322,0.13525726361383164,0.1406813550505297,0.1417224503310724,0.09234063936990548,0.09048022696667041,0.09470717852014171,0.06669009565900856,0.0766154517928185,0.07115533098049315,0.05300191714918148,0.050309611013413746,0.032958679243266654,0.017286157767884818,0.017316675608425754,0.017725091822240933,0.01727424322099934,0.01686463364967079,0.01643900677596853,0.017709054747084705,0.01805345514388342,0.018459564213096226,0.018217972463836194,0.019539661643931956,0.015341189087781325,0.01742113838867753,0.021351506825431202,0.019169442788193786,0.019791217058523946,0.0,0.0,0.0,0.0,0.0,0.0,0.0,0.0,0.0,0.0,0.0,0.0,0.0,0.0,0.0,0.0,0.0,0.0,0.0,0.0,0.0,0.0,0.0,0.0,0.0,0.0,0.0,0.0,0.0,0.0,0.0,0.0,0.0,0.0,0.0,0.0,0.0,0.0,0.0,0.0,0.0,0.0,0.0,0.0,0.0,0.0,0.0,0.0,0.0,0.0,0.0,0.0,0.0,0.0,0.0,0.0,0.0,0.0,0.0,0.0,0.0,0.0,0.0,0.0,0.0,0.0,0.0,0.0,0.0,0.0,0.0,0.0,0.0,0.0,0.0,0.0,0.0,0.0,0.0,0.0,0.0,0.0,0.0,0.0,0.0,0.0,0.0,0.0,0.0,0.0,0.0,0.0,0.0,0.0,0.0,0.0,0.0,0.0,0.0,0.0,0.0,0.0,0.0,0.0,0.0,0.0,0.0,0.0,0.0,0.0,0.0,0.0,0.0,0.0,0.0,0.0,0.0,0.0,0.0,0.0,0.0,0.0,0.0,0.0,0.0,0.0,0.0,0.0,0.0,0.0,0.0,0.0,0.0,0.0
"('hermance', '11/6/2022')",Hermance,2022-06-11,0,0.0,Petit lac,0.25088644085149364,0.20109664452740322,0.13525726361383164,0.1406813550505297,0.1417224503310724,0.09234063936990548,0.09048022696667041,0.09470717852014171,0.06669009565900856,0.0766154517928185,0.07115533098049315,0.05300191714918148,0.050309611013413746,0.032958679243266654,0.017286157767884818,0.017316675608425754,0.017725091822240933,0.01727424322099934,0.01686463364967079,0.01643900677596853,0.017709054747084705,0.01805345514388342,0.018459564213096226,0.018217972463836194,0.019539661643931956,0.015341189087781325,0.01742113838867753,0.021351506825431202,0.019169442788193786,0.019791217058523946,0.0,0.0,0.0,0.0,0.0,0.0,0.0,0.0,0.0,0.0,0.0,0.0,0.0,0.0,0.0,0.0,0.0,0.0,0.0,0.0,0.0,0.0,0.0,0.0,0.0,0.0,0.0,0.0,0.0,0.0,0.0,0.0,0.0,0.0,0.0,0.0,0.0,0.0,0.0,0.0,0.0,0.0,0.0,0.0,0.0,0.0,0.0,0.0,0.0,0.0,0.0,0.0,0.0,0.0,0.0,0.0,0.0,0.0,0.0,0.0,0.0,0.0,0.0,0.0,0.0,0.0,0.0,0.0,0.0,0.0,0.0,0.0,0.0,0.0,0.0,0.0,0.0,0.0,0.0,0.0,0.0,0.0,0.0,0.0,0.0,0.0,0.0,0.0,0.0,0.0,0.0,0.0,0.0,0.0,0.0,0.0,0.0,0.0,0.0,0.0,0.0,0.0,0.0,0.0,0.0,0.0,0.0,0.0,0.0,0.0,0.0,0.0,0.0,0.0,0.0,0.0,0.0,0.0,0.0,0.0,0.0,0.0,0.0,0.0,0.0,0.0,0.0,0.0,0.0,0.0,0.0,0.0,0.0,0.0
"('hermance', '5/14/2022')",Hermance,2022-05-14,0,0.0,Petit lac,0.25088644085149364,0.20109664452740322,0.13525726361383164,0.1406813550505297,0.1417224503310724,0.09234063936990548,0.09048022696667041,0.09470717852014171,0.06669009565900856,0.0766154517928185,0.07115533098049315,0.05300191714918148,0.050309611013413746,0.032958679243266654,0.017286157767884818,0.017316675608425754,0.017725091822240933,0.01727424322099934,0.01686463364967079,0.01643900677596853,0.017709054747084705,0.01805345514388342,0.018459564213096226,0.018217972463836194,0.019539661643931956,0.015341189087781325,0.01742113838867753,0.021351506825431202,0.019169442788193786,0.019791217058523946,0.0,0.0,0.0,0.0,0.0,0.0,0.0,0.0,0.0,0.0,0.0,0.0,0.0,0.0,0.0,0.0,0.0,0.0,0.0,0.0,0.0,0.0,0.0,0.0,0.0,0.0,0.0,0.0,0.0,0.0,0.0,0.0,0.0,0.0,0.0,0.0,0.0,0.0,0.0,0.0,0.0,0.0,0.0,0.0,0.0,0.0,0.0,0.0,0.0,0.0,0.0,0.0,0.0,0.0,0.0,0.0,0.0,0.0,0.0,0.0,0.0,0.0,0.0,0.0,0.0,0.0,0.0,0.0,0.0,0.0,0.0,0.0,0.0,0.0,0.0,0.0,0.0,0.0,0.0,0.0,0.0,0.0,0.0,0.0,0.0,0.0,0.0,0.0,0.0,0.0,0.0,0.0,0.0,0.0,0.0,0.0,0.0,0.0,0.0,0.0,0.0,0.0,0.0,0.0,0.0,0.0,0.0,0.0,0.0,0.0,0.0,0.0,0.0,0.0,0.0,0.0,0.0,0.0,0.0,0.0,0.0,0.0,0.0,0.0,0.0,0.0,0.0,0.0,0.0,0.0,0.0,0.0,0.0,0.0
"('hermance', '9/11/2022')",Hermance,2022-11-09,0,0.0,Petit lac,0.25088644085149364,0.20109664452740322,0.13525726361383164,0.1406813550505297,0.1417224503310724,0.09234063936990548,0.09048022696667041,0.09470717852014171,0.06669009565900856,0.0766154517928185,0.07115533098049315,0.05300191714918148,0.050309611013413746,0.032958679243266654,0.017286157767884818,0.017316675608425754,0.017725091822240933,0.01727424322099934,0.01686463364967079,0.01643900677596853,0.017709054747084705,0.01805345514388342,0.018459564213096226,0.018217972463836194,0.019539661643931956,0.015341189087781325,0.01742113838867753,0.021351506825431202,0.019169442788193786,0.019791217058523946,0.0,0.0,0.0,0.0,0.0,0.0,0.0,0.0,0.0,0.0,0.0,0.0,0.0,0.0,0.0,0.0,0.0,0.0,0.0,0.0,0.0,0.0,0.0,0.0,0.0,0.0,0.0,0.0,0.0,0.0,0.0,0.0,0.0,0.0,0.0,0.0,0.0,0.0,0.0,0.0,0.0,0.0,0.0,0.0,0.0,0.0,0.0,0.0,0.0,0.0,0.0,0.0,0.0,0.0,0.0,0.0,0.0,0.0,0.0,0.0,0.0,0.0,0.0,0.0,0.0,0.0,0.0,0.0,0.0,0.0,0.0,0.0,0.0,0.0,0.0,0.0,0.0,0.0,0.0,0.0,0.0,0.0,0.0,0.0,0.0,0.0,0.0,0.0,0.0,0.0,0.0,0.0,0.0,0.0,0.0,0.0,0.0,0.0,0.0,0.0,0.0,0.0,0.0,0.0,0.0,0.0,0.0,0.0,0.0,0.0,0.0,0.0,0.0,0.0,0.0,0.0,0.0,0.0,0.0,0.0,0.0,0.0,0.0,0.0,0.0,0.0,0.0,0.0,0.0,0.0,0.0,0.0,0.0,0.0
"('lugrin', '06.02.2022')",Lugrin,2022-02-06,0,0.0,Grand lac,0.37659768214859385,0.37116540559001904,0.32062289604341765,0.23135208044965797,0.1825787499122583,0.14864064483815642,0.14124995869815873,0.10271449356329329,0.11010605035818469,0.10548186783385015,0.10102493854044224,0.10367743028446792,0.08679076107526087,0.06499205741253355,0.0470223372239593,0.052705288754361715,0.052867925736533386,0.027953068395873557,0.03665653178351209,0.03422791979709275,0.035808143716527095,0.03499386380037143,0.0,0.0,0.0,0.0,0.0,0.0,0.0,0.0,0.0,0.0,0.0,0.0,0.0,0.0,0.0,0.0,0.0,0.0,0.0,0.0,0.0,0.0,0.0,0.0,0.0,0.0,0.0,0.0,0.0,0.0,0.0,0.0,0.0,0.0,0.0,0.0,0.0,0.0,0.0,0.0,0.0,0.0,0.0,0.0,0.0,0.0,0.0,0.0,0.0,0.0,0.0,0.0,0.0,0.0,0.0,0.0,0.0,0.0,0.0,0.0,0.0,0.0,0.0,0.0,0.0,0.0,0.0,0.0,0.0,0.0,0.0,0.0,0.0,0.0,0.0,0.0,0.0,0.0,0.0,0.0,0.0,0.0,0.0,0.0,0.0,0.0,0.0,0.0,0.0,0.0,0.0,0.0,0.0,0.0,0.0,0.0,0.0,0.0,0.0,0.0,0.0,0.0,0.0,0.0,0.0,0.0,0.0,0.0,0.0,0.0,0.0,0.0,0.0,0.0,0.0,0.0,0.0,0.0,0.0,0.0,0.0,0.0,0.0,0.0,0.0,0.0,0.0,0.0,0.0,0.0,0.0,0.0,0.0,0.0,0.0,0.0,0.0,0.0,0.0,0.0,0.0,0.0
"('lutry', '29.01.2022')",Lutry,2022-01-29,0,0.0,Grand lac,0.37659768214859385,0.37116540559001904,0.32062289604341765,0.23135208044965797,0.1825787499122583,0.14864064483815642,0.14124995869815873,0.10271449356329329,0.11010605035818469,0.10548186783385015,0.10102493854044224,0.10367743028446792,0.08679076107526087,0.06499205741253355,0.0470223372239593,0.052705288754361715,0.052867925736533386,0.027953068395873557,0.03665653178351209,0.03422791979709275,0.035808143716527095,0.03499386380037143,0.0,0.0,0.0,0.0,0.0,0.0,0.0,0.0,0.0,0.0,0.0,0.0,0.0,0.0,0.0,0.0,0.0,0.0,0.0,0.0,0.0,0.0,0.0,0.0,0.0,0.0,0.0,0.0,0.0,0.0,0.0,0.0,0.0,0.0,0.0,0.0,0.0,0.0,0.0,0.0,0.0,0.0,0.0,0.0,0.0,0.0,0.0,0.0,0.0,0.0,0.0,0.0,0.0,0.0,0.0,0.0,0.0,0.0,0.0,0.0,0.0,0.0,0.0,0.0,0.0,0.0,0.0,0.0,0.0,0.0,0.0,0.0,0.0,0.0,0.0,0.0,0.0,0.0,0.0,0.0,0.0,0.0,0.0,0.0,0.0,0.0,0.0,0.0,0.0,0.0,0.0,0.0,0.0,0.0,0.0,0.0,0.0,0.0,0.0,0.0,0.0,0.0,0.0,0.0,0.0,0.0,0.0,0.0,0.0,0.0,0.0,0.0,0.0,0.0,0.0,0.0,0.0,0.0,0.0,0.0,0.0,0.0,0.0,0.0,0.0,0.0,0.0,0.0,0.0,0.0,0.0,0.0,0.0,0.0,0.0,0.0,0.0,0.0,0.0,0.0,0.0,0.0
"('meillerie', '02.05.2022')",Meillerie,2022-05-02,0,0.0,Haut lac,0.7302797692049658,0.6999677024452676,0.6057567125840336,0.5352017498503865,0.5264214817367325,0.4340904197719102,0.42523065510491137,0.4122581083916993,0.3793644217936407,0.3500374710334708,0.34649679838981323,0.33140263491978544,0.31947746286079326,0.29411411087594663,0.27905203360764796,0.2762130034332507,0.2675156938245815,0.2359914086142253,0.23739478454494037,0.22062980721104034,0.21039339145187974,0.21093214308098443,0.1990377970561429,0.191805899057051,0.18171177988439413,0.1773815445095092,0.16558671241730544,0.15835489810784883,0.1482169954891922,0.15343383877784816,0.14196132295257216,0.14191287137647277,0.12966100164875566,0.13539463500616072,0.12822021175189932,0.12575122007672282,0.0,0.0,0.0,0.0,0.0,0.0,0.0,0.0,0.0,0.0,0.0,0.0,0.0,0.0,0.0,0.0,0.0,0.0,0.0,0.0,0.0,0.0,0.0,0.0,0.0,0.0,0.0,0.0,0.0,0.0,0.0,0.0,0.0,0.0,0.0,0.0,0.0,0.0,0.0,0.0,0.0,0.0,0.0,0.0,0.0,0.0,0.0,0.0,0.0,0.0,0.0,0.0,0.0,0.0,0.0,0.0,0.0,0.0,0.0,0.0,0.0,0.0,0.0,0.0,0.0,0.0,0.0,0.0,0.0,0.0,0.0,0.0,0.0,0.0,0.0,0.0,0.0,0.0,0.0,0.0,0.0,0.0,0.0,0.0,0.0,0.0,0.0,0.0,0.0,0.0,0.0,0.0,0.0,0.0,0.0,0.0,0.0,0.0,0.0,0.0,0.0,0.0,0.0,0.0,0.0,0.0,0.0,0.0,0.0,0.0,0.0,0.0,0.0,0.0,0.0,0.0,0.0,0.0,0.0,0.0,0.0,0.0,0.0,0.0,0.0,0.0,0.0,0.0
"('meillerie', '08.11.2022')",Meillerie,2022-11-08,0,0.0,Haut lac,0.7302797692049658,0.6999677024452676,0.6057567125840336,0.5352017498503865,0.5264214817367325,0.4340904197719102,0.42523065510491137,0.4122581083916993,0.3793644217936407,0.3500374710334708,0.34649679838981323,0.33140263491978544,0.31947746286079326,0.29411411087594663,0.27905203360764796,0.2762130034332507,0.2675156938245815,0.2359914086142253,0.23739478454494037,0.22062980721104034,0.21039339145187974,0.21093214308098443,0.1990377970561429,0.191805899057051,0.18171177988439413,0.1773815445095092,0.16558671241730544,0.15835489810784883,0.1482169954891922,0.15343383877784816,0.14196132295257216,0.14191287137647277,0.12966100164875566,0.13539463500616072,0.12822021175189932,0.12575122007672282,0.0,0.0,0.0,0.0,0.0,0.0,0.0,0.0,0.0,0.0,0.0,0.0,0.0,0.0,0.0,0.0,0.0,0.0,0.0,0.0,0.0,0.0,0.0,0.0,0.0,0.0,0.0,0.0,0.0,0.0,0.0,0.0,0.0,0.0,0.0,0.0,0.0,0.0,0.0,0.0,0.0,0.0,0.0,0.0,0.0,0.0,0.0,0.0,0.0,0.0,0.0,0.0,0.0,0.0,0.0,0.0,0.0,0.0,0.0,0.0,0.0,0.0,0.0,0.0,0.0,0.0,0.0,0.0,0.0,0.0,0.0,0.0,0.0,0.0,0.0,0.0,0.0,0.0,0.0,0.0,0.0,0.0,0.0,0.0,0.0,0.0,0.0,0.0,0.0,0.0,0.0,0.0,0.0,0.0,0.0,0.0,0.0,0.0,0.0,0.0,0.0,0.0,0.0,0.0,0.0,0.0,0.0,0.0,0.0,0.0,0.0,0.0,0.0,0.0,0.0,0.0,0.0,0.0,0.0,0.0,0.0,0.0,0.0,0.0,0.0,0.0,0.0,0.0
"('meillerie', '18.07.2022')",Meillerie,2022-07-18,0,0.0,Haut lac,0.7302797692049658,0.6999677024452676,0.6057567125840336,0.5352017498503865,0.5264214817367325,0.4340904197719102,0.42523065510491137,0.4122581083916993,0.3793644217936407,0.3500374710334708,0.34649679838981323,0.33140263491978544,0.31947746286079326,0.29411411087594663,0.27905203360764796,0.2762130034332507,0.2675156938245815,0.2359914086142253,0.23739478454494037,0.22062980721104034,0.21039339145187974,0.21093214308098443,0.1990377970561429,0.191805899057051,0.18171177988439413,0.1773815445095092,0.16558671241730544,0.15835489810784883,0.1482169954891922,0.15343383877784816,0.14196132295257216,0.14191287137647277,0.12966100164875566,0.13539463500616072,0.12822021175189932,0.12575122007672282,0.0,0.0,0.0,0.0,0.0,0.0,0.0,0.0,0.0,0.0,0.0,0.0,0.0,0.0,0.0,0.0,0.0,0.0,0.0,0.0,0.0,0.0,0.0,0.0,0.0,0.0,0.0,0.0,0.0,0.0,0.0,0.0,0.0,0.0,0.0,0.0,0.0,0.0,0.0,0.0,0.0,0.0,0.0,0.0,0.0,0.0,0.0,0.0,0.0,0.0,0.0,0.0,0.0,0.0,0.0,0.0,0.0,0.0,0.0,0.0,0.0,0.0,0.0,0.0,0.0,0.0,0.0,0.0,0.0,0.0,0.0,0.0,0.0,0.0,0.0,0.0,0.0,0.0,0.0,0.0,0.0,0.0,0.0,0.0,0.0,0.0,0.0,0.0,0.0,0.0,0.0,0.0,0.0,0.0,0.0,0.0,0.0,0.0,0.0,0.0,0.0,0.0,0.0,0.0,0.0,0.0,0.0,0.0,0.0,0.0,0.0,0.0,0.0,0.0,0.0,0.0,0.0,0.0,0.0,0.0,0.0,0.0,0.0,0.0,0.0,0.0,0.0,0.0
"('meillerie', '24.01.2022')",Meillerie,2022-01-24,0,0.0,Haut lac,0.7302797692049658,0.6999677024452676,0.6057567125840336,0.5352017498503865,0.5264214817367325,0.4340904197719102,0.42523065510491137,0.4122581083916993,0.3793644217936407,0.3500374710334708,0.34649679838981323,0.33140263491978544,0.31947746286079326,0.29411411087594663,0.27905203360764796,0.2762130034332507,0.2675156938245815,0.2359914086142253,0.23739478454494037,0.22062980721104034,0.21039339145187974,0.21093214308098443,0.1990377970561429,0.191805899057051,0.18171177988439413,0.1773815445095092,0.16558671241730544,0.15835489810784883,0.1482169954891922,0.15343383877784816,0.14196132295257216,0.14191287137647277,0.12966100164875566,0.13539463500616072,0.12822021175189932,0.12575122007672282,0.0,0.0,0.0,0.0,0.0,0.0,0.0,0.0,0.0,0.0,0.0,0.0,0.0,0.0,0.0,0.0,0.0,0.0,0.0,0.0,0.0,0.0,0.0,0.0,0.0,0.0,0.0,0.0,0.0,0.0,0.0,0.0,0.0,0.0,0.0,0.0,0.0,0.0,0.0,0.0,0.0,0.0,0.0,0.0,0.0,0.0,0.0,0.0,0.0,0.0,0.0,0.0,0.0,0.0,0.0,0.0,0.0,0.0,0.0,0.0,0.0,0.0,0.0,0.0,0.0,0.0,0.0,0.0,0.0,0.0,0.0,0.0,0.0,0.0,0.0,0.0,0.0,0.0,0.0,0.0,0.0,0.0,0.0,0.0,0.0,0.0,0.0,0.0,0.0,0.0,0.0,0.0,0.0,0.0,0.0,0.0,0.0,0.0,0.0,0.0,0.0,0.0,0.0,0.0,0.0,0.0,0.0,0.0,0.0,0.0,0.0,0.0,0.0,0.0,0.0,0.0,0.0,0.0,0.0,0.0,0.0,0.0,0.0,0.0,0.0,0.0,0.0,0.0
"('pichette', '11.05.2022')",Pichette,2022-05-11,0,0.0,Haut lac,0.7302797692049658,0.6999677024452676,0.6057567125840336,0.5352017498503865,0.5264214817367325,0.4340904197719102,0.42523065510491137,0.4122581083916993,0.3793644217936407,0.3500374710334708,0.34649679838981323,0.33140263491978544,0.31947746286079326,0.29411411087594663,0.27905203360764796,0.2762130034332507,0.2675156938245815,0.2359914086142253,0.23739478454494037,0.22062980721104034,0.21039339145187974,0.21093214308098443,0.1990377970561429,0.191805899057051,0.18171177988439413,0.1773815445095092,0.16558671241730544,0.15835489810784883,0.1482169954891922,0.15343383877784816,0.14196132295257216,0.14191287137647277,0.12966100164875566,0.13539463500616072,0.12822021175189932,0.12575122007672282,0.0,0.0,0.0,0.0,0.0,0.0,0.0,0.0,0.0,0.0,0.0,0.0,0.0,0.0,0.0,0.0,0.0,0.0,0.0,0.0,0.0,0.0,0.0,0.0,0.0,0.0,0.0,0.0,0.0,0.0,0.0,0.0,0.0,0.0,0.0,0.0,0.0,0.0,0.0,0.0,0.0,0.0,0.0,0.0,0.0,0.0,0.0,0.0,0.0,0.0,0.0,0.0,0.0,0.0,0.0,0.0,0.0,0.0,0.0,0.0,0.0,0.0,0.0,0.0,0.0,0.0,0.0,0.0,0.0,0.0,0.0,0.0,0.0,0.0,0.0,0.0,0.0,0.0,0.0,0.0,0.0,0.0,0.0,0.0,0.0,0.0,0.0,0.0,0.0,0.0,0.0,0.0,0.0,0.0,0.0,0.0,0.0,0.0,0.0,0.0,0.0,0.0,0.0,0.0,0.0,0.0,0.0,0.0,0.0,0.0,0.0,0.0,0.0,0.0,0.0,0.0,0.0,0.0,0.0,0.0,0.0,0.0,0.0,0.0,0.0,0.0,0.0,0.0
"('pichette', '13.12.2022')",Pichette,2022-12-13,0,0.0,Haut lac,0.7302797692049658,0.6999677024452676,0.6057567125840336,0.5352017498503865,0.5264214817367325,0.4340904197719102,0.42523065510491137,0.4122581083916993,0.3793644217936407,0.3500374710334708,0.34649679838981323,0.33140263491978544,0.31947746286079326,0.29411411087594663,0.27905203360764796,0.2762130034332507,0.2675156938245815,0.2359914086142253,0.23739478454494037,0.22062980721104034,0.21039339145187974,0.21093214308098443,0.1990377970561429,0.191805899057051,0.18171177988439413,0.1773815445095092,0.16558671241730544,0.15835489810784883,0.1482169954891922,0.15343383877784816,0.14196132295257216,0.14191287137647277,0.12966100164875566,0.13539463500616072,0.12822021175189932,0.12575122007672282,0.0,0.0,0.0,0.0,0.0,0.0,0.0,0.0,0.0,0.0,0.0,0.0,0.0,0.0,0.0,0.0,0.0,0.0,0.0,0.0,0.0,0.0,0.0,0.0,0.0,0.0,0.0,0.0,0.0,0.0,0.0,0.0,0.0,0.0,0.0,0.0,0.0,0.0,0.0,0.0,0.0,0.0,0.0,0.0,0.0,0.0,0.0,0.0,0.0,0.0,0.0,0.0,0.0,0.0,0.0,0.0,0.0,0.0,0.0,0.0,0.0,0.0,0.0,0.0,0.0,0.0,0.0,0.0,0.0,0.0,0.0,0.0,0.0,0.0,0.0,0.0,0.0,0.0,0.0,0.0,0.0,0.0,0.0,0.0,0.0,0.0,0.0,0.0,0.0,0.0,0.0,0.0,0.0,0.0,0.0,0.0,0.0,0.0,0.0,0.0,0.0,0.0,0.0,0.0,0.0,0.0,0.0,0.0,0.0,0.0,0.0,0.0,0.0,0.0,0.0,0.0,0.0,0.0,0.0,0.0,0.0,0.0,0.0,0.0,0.0,0.0,0.0,0.0
"('pichette', '14.09.2022')",Pichette,2022-09-14,0,0.0,Haut lac,0.7302797692049658,0.6999677024452676,0.6057567125840336,0.5352017498503865,0.5264214817367325,0.4340904197719102,0.42523065510491137,0.4122581083916993,0.3793644217936407,0.3500374710334708,0.34649679838981323,0.33140263491978544,0.31947746286079326,0.29411411087594663,0.27905203360764796,0.2762130034332507,0.2675156938245815,0.2359914086142253,0.23739478454494037,0.22062980721104034,0.21039339145187974,0.21093214308098443,0.1990377970561429,0.191805899057051,0.18171177988439413,0.1773815445095092,0.16558671241730544,0.15835489810784883,0.1482169954891922,0.15343383877784816,0.14196132295257216,0.14191287137647277,0.12966100164875566,0.13539463500616072,0.12822021175189932,0.12575122007672282,0.0,0.0,0.0,0.0,0.0,0.0,0.0,0.0,0.0,0.0,0.0,0.0,0.0,0.0,0.0,0.0,0.0,0.0,0.0,0.0,0.0,0.0,0.0,0.0,0.0,0.0,0.0,0.0,0.0,0.0,0.0,0.0,0.0,0.0,0.0,0.0,0.0,0.0,0.0,0.0,0.0,0.0,0.0,0.0,0.0,0.0,0.0,0.0,0.0,0.0,0.0,0.0,0.0,0.0,0.0,0.0,0.0,0.0,0.0,0.0,0.0,0.0,0.0,0.0,0.0,0.0,0.0,0.0,0.0,0.0,0.0,0.0,0.0,0.0,0.0,0.0,0.0,0.0,0.0,0.0,0.0,0.0,0.0,0.0,0.0,0.0,0.0,0.0,0.0,0.0,0.0,0.0,0.0,0.0,0.0,0.0,0.0,0.0,0.0,0.0,0.0,0.0,0.0,0.0,0.0,0.0,0.0,0.0,0.0,0.0,0.0,0.0,0.0,0.0,0.0,0.0,0.0,0.0,0.0,0.0,0.0,0.0,0.0,0.0,0.0,0.0,0.0,0.0
"('port-choiseul', '03.09.2022')",Port Choiseul,2022-09-03,0,0.0,Petit lac,0.25088644085149364,0.20109664452740322,0.13525726361383164,0.1406813550505297,0.1417224503310724,0.09234063936990548,0.09048022696667041,0.09470717852014171,0.06669009565900856,0.0766154517928185,0.07115533098049315,0.05300191714918148,0.050309611013413746,0.032958679243266654,0.017286157767884818,0.017316675608425754,0.017725091822240933,0.01727424322099934,0.01686463364967079,0.01643900677596853,0.017709054747084705,0.01805345514388342,0.018459564213096226,0.018217972463836194,0.019539661643931956,0.015341189087781325,0.01742113838867753,0.021351506825431202,0.019169442788193786,0.019791217058523946,0.0,0.0,0.0,0.0,0.0,0.0,0.0,0.0,0.0,0.0,0.0,0.0,0.0,0.0,0.0,0.0,0.0,0.0,0.0,0.0,0.0,0.0,0.0,0.0,0.0,0.0,0.0,0.0,0.0,0.0,0.0,0.0,0.0,0.0,0.0,0.0,0.0,0.0,0.0,0.0,0.0,0.0,0.0,0.0,0.0,0.0,0.0,0.0,0.0,0.0,0.0,0.0,0.0,0.0,0.0,0.0,0.0,0.0,0.0,0.0,0.0,0.0,0.0,0.0,0.0,0.0,0.0,0.0,0.0,0.0,0.0,0.0,0.0,0.0,0.0,0.0,0.0,0.0,0.0,0.0,0.0,0.0,0.0,0.0,0.0,0.0,0.0,0.0,0.0,0.0,0.0,0.0,0.0,0.0,0.0,0.0,0.0,0.0,0.0,0.0,0.0,0.0,0.0,0.0,0.0,0.0,0.0,0.0,0.0,0.0,0.0,0.0,0.0,0.0,0.0,0.0,0.0,0.0,0.0,0.0,0.0,0.0,0.0,0.0,0.0,0.0,0.0,0.0,0.0,0.0,0.0,0.0,0.0,0.0
"('port-choiseul', '15.10.2022')",Port Choiseul,2022-10-15,0,0.0,Petit lac,0.25088644085149364,0.20109664452740322,0.13525726361383164,0.1406813550505297,0.1417224503310724,0.09234063936990548,0.09048022696667041,0.09470717852014171,0.06669009565900856,0.0766154517928185,0.07115533098049315,0.05300191714918148,0.050309611013413746,0.032958679243266654,0.017286157767884818,0.017316675608425754,0.017725091822240933,0.01727424322099934,0.01686463364967079,0.01643900677596853,0.017709054747084705,0.01805345514388342,0.018459564213096226,0.018217972463836194,0.019539661643931956,0.015341189087781325,0.01742113838867753,0.021351506825431202,0.019169442788193786,0.019791217058523946,0.0,0.0,0.0,0.0,0.0,0.0,0.0,0.0,0.0,0.0,0.0,0.0,0.0,0.0,0.0,0.0,0.0,0.0,0.0,0.0,0.0,0.0,0.0,0.0,0.0,0.0,0.0,0.0,0.0,0.0,0.0,0.0,0.0,0.0,0.0,0.0,0.0,0.0,0.0,0.0,0.0,0.0,0.0,0.0,0.0,0.0,0.0,0.0,0.0,0.0,0.0,0.0,0.0,0.0,0.0,0.0,0.0,0.0,0.0,0.0,0.0,0.0,0.0,0.0,0.0,0.0,0.0,0.0,0.0,0.0,0.0,0.0,0.0,0.0,0.0,0.0,0.0,0.0,0.0,0.0,0.0,0.0,0.0,0.0,0.0,0.0,0.0,0.0,0.0,0.0,0.0,0.0,0.0,0.0,0.0,0.0,0.0,0.0,0.0,0.0,0.0,0.0,0.0,0.0,0.0,0.0,0.0,0.0,0.0,0.0,0.0,0.0,0.0,0.0,0.0,0.0,0.0,0.0,0.0,0.0,0.0,0.0,0.0,0.0,0.0,0.0,0.0,0.0,0.0,0.0,0.0,0.0,0.0,0.0
"('preverenges', '12.02.2022')",Préverenges,2022-02-12,0,0.0,Grand lac,0.37659768214859385,0.37116540559001904,0.32062289604341765,0.23135208044965797,0.1825787499122583,0.14864064483815642,0.14124995869815873,0.10271449356329329,0.11010605035818469,0.10548186783385015,0.10102493854044224,0.10367743028446792,0.08679076107526087,0.06499205741253355,0.0470223372239593,0.052705288754361715,0.052867925736533386,0.027953068395873557,0.03665653178351209,0.03422791979709275,0.035808143716527095,0.03499386380037143,0.0,0.0,0.0,0.0,0.0,0.0,0.0,0.0,0.0,0.0,0.0,0.0,0.0,0.0,0.0,0.0,0.0,0.0,0.0,0.0,0.0,0.0,0.0,0.0,0.0,0.0,0.0,0.0,0.0,0.0,0.0,0.0,0.0,0.0,0.0,0.0,0.0,0.0,0.0,0.0,0.0,0.0,0.0,0.0,0.0,0.0,0.0,0.0,0.0,0.0,0.0,0.0,0.0,0.0,0.0,0.0,0.0,0.0,0.0,0.0,0.0,0.0,0.0,0.0,0.0,0.0,0.0,0.0,0.0,0.0,0.0,0.0,0.0,0.0,0.0,0.0,0.0,0.0,0.0,0.0,0.0,0.0,0.0,0.0,0.0,0.0,0.0,0.0,0.0,0.0,0.0,0.0,0.0,0.0,0.0,0.0,0.0,0.0,0.0,0.0,0.0,0.0,0.0,0.0,0.0,0.0,0.0,0.0,0.0,0.0,0.0,0.0,0.0,0.0,0.0,0.0,0.0,0.0,0.0,0.0,0.0,0.0,0.0,0.0,0.0,0.0,0.0,0.0,0.0,0.0,0.0,0.0,0.0,0.0,0.0,0.0,0.0,0.0,0.0,0.0,0.0,0.0
"('preverenges', '13.08.2022')",Préverenges,2022-08-13,0,0.0,Grand lac,0.37659768214859385,0.37116540559001904,0.32062289604341765,0.23135208044965797,0.1825787499122583,0.14864064483815642,0.14124995869815873,0.10271449356329329,0.11010605035818469,0.10548186783385015,0.10102493854044224,0.10367743028446792,0.08679076107526087,0.06499205741253355,0.0470223372239593,0.052705288754361715,0.052867925736533386,0.027953068395873557,0.03665653178351209,0.03422791979709275,0.035808143716527095,0.03499386380037143,0.0,0.0,0.0,0.0,0.0,0.0,0.0,0.0,0.0,0.0,0.0,0.0,0.0,0.0,0.0,0.0,0.0,0.0,0.0,0.0,0.0,0.0,0.0,0.0,0.0,0.0,0.0,0.0,0.0,0.0,0.0,0.0,0.0,0.0,0.0,0.0,0.0,0.0,0.0,0.0,0.0,0.0,0.0,0.0,0.0,0.0,0.0,0.0,0.0,0.0,0.0,0.0,0.0,0.0,0.0,0.0,0.0,0.0,0.0,0.0,0.0,0.0,0.0,0.0,0.0,0.0,0.0,0.0,0.0,0.0,0.0,0.0,0.0,0.0,0.0,0.0,0.0,0.0,0.0,0.0,0.0,0.0,0.0,0.0,0.0,0.0,0.0,0.0,0.0,0.0,0.0,0.0,0.0,0.0,0.0,0.0,0.0,0.0,0.0,0.0,0.0,0.0,0.0,0.0,0.0,0.0,0.0,0.0,0.0,0.0,0.0,0.0,0.0,0.0,0.0,0.0,0.0,0.0,0.0,0.0,0.0,0.0,0.0,0.0,0.0,0.0,0.0,0.0,0.0,0.0,0.0,0.0,0.0,0.0,0.0,0.0,0.0,0.0,0.0,0.0,0.0,0.0
"('rolle', '01.05.2022')",Rolle,2022-05-01,0,0.0,Grand lac,0.37659768214859385,0.37116540559001904,0.32062289604341765,0.23135208044965797,0.1825787499122583,0.14864064483815642,0.14124995869815873,0.10271449356329329,0.11010605035818469,0.10548186783385015,0.10102493854044224,0.10367743028446792,0.08679076107526087,0.06499205741253355,0.0470223372239593,0.052705288754361715,0.052867925736533386,0.027953068395873557,0.03665653178351209,0.03422791979709275,0.035808143716527095,0.03499386380037143,0.0,0.0,0.0,0.0,0.0,0.0,0.0,0.0,0.0,0.0,0.0,0.0,0.0,0.0,0.0,0.0,0.0,0.0,0.0,0.0,0.0,0.0,0.0,0.0,0.0,0.0,0.0,0.0,0.0,0.0,0.0,0.0,0.0,0.0,0.0,0.0,0.0,0.0,0.0,0.0,0.0,0.0,0.0,0.0,0.0,0.0,0.0,0.0,0.0,0.0,0.0,0.0,0.0,0.0,0.0,0.0,0.0,0.0,0.0,0.0,0.0,0.0,0.0,0.0,0.0,0.0,0.0,0.0,0.0,0.0,0.0,0.0,0.0,0.0,0.0,0.0,0.0,0.0,0.0,0.0,0.0,0.0,0.0,0.0,0.0,0.0,0.0,0.0,0.0,0.0,0.0,0.0,0.0,0.0,0.0,0.0,0.0,0.0,0.0,0.0,0.0,0.0,0.0,0.0,0.0,0.0,0.0,0.0,0.0,0.0,0.0,0.0,0.0,0.0,0.0,0.0,0.0,0.0,0.0,0.0,0.0,0.0,0.0,0.0,0.0,0.0,0.0,0.0,0.0,0.0,0.0,0.0,0.0,0.0,0.0,0.0,0.0,0.0,0.0,0.0,0.0,0.0
"('rolle', '06.11.2022')",Rolle,2022-11-06,0,0.0,Grand lac,0.37659768214859385,0.37116540559001904,0.32062289604341765,0.23135208044965797,0.1825787499122583,0.14864064483815642,0.14124995869815873,0.10271449356329329,0.11010605035818469,0.10548186783385015,0.10102493854044224,0.10367743028446792,0.08679076107526087,0.06499205741253355,0.0470223372239593,0.052705288754361715,0.052867925736533386,0.027953068395873557,0.03665653178351209,0.03422791979709275,0.035808143716527095,0.03499386380037143,0.0,0.0,0.0,0.0,0.0,0.0,0.0,0.0,0.0,0.0,0.0,0.0,0.0,0.0,0.0,0.0,0.0,0.0,0.0,0.0,0.0,0.0,0.0,0.0,0.0,0.0,0.0,0.0,0.0,0.0,0.0,0.0,0.0,0.0,0.0,0.0,0.0,0.0,0.0,0.0,0.0,0.0,0.0,0.0,0.0,0.0,0.0,0.0,0.0,0.0,0.0,0.0,0.0,0.0,0.0,0.0,0.0,0.0,0.0,0.0,0.0,0.0,0.0,0.0,0.0,0.0,0.0,0.0,0.0,0.0,0.0,0.0,0.0,0.0,0.0,0.0,0.0,0.0,0.0,0.0,0.0,0.0,0.0,0.0,0.0,0.0,0.0,0.0,0.0,0.0,0.0,0.0,0.0,0.0,0.0,0.0,0.0,0.0,0.0,0.0,0.0,0.0,0.0,0.0,0.0,0.0,0.0,0.0,0.0,0.0,0.0,0.0,0.0,0.0,0.0,0.0,0.0,0.0,0.0,0.0,0.0,0.0,0.0,0.0,0.0,0.0,0.0,0.0,0.0,0.0,0.0,0.0,0.0,0.0,0.0,0.0,0.0,0.0,0.0,0.0,0.0,0.0
"('rolle', '15.01.2022')",Rolle,2022-01-15,0,0.0,Grand lac,0.37659768214859385,0.37116540559001904,0.32062289604341765,0.23135208044965797,0.1825787499122583,0.14864064483815642,0.14124995869815873,0.10271449356329329,0.11010605035818469,0.10548186783385015,0.10102493854044224,0.10367743028446792,0.08679076107526087,0.06499205741253355,0.0470223372239593,0.052705288754361715,0.052867925736533386,0.027953068395873557,0.03665653178351209,0.03422791979709275,0.035808143716527095,0.03499386380037143,0.0,0.0,0.0,0.0,0.0,0.0,0.0,0.0,0.0,0.0,0.0,0.0,0.0,0.0,0.0,0.0,0.0,0.0,0.0,0.0,0.0,0.0,0.0,0.0,0.0,0.0,0.0,0.0,0.0,0.0,0.0,0.0,0.0,0.0,0.0,0.0,0.0,0.0,0.0,0.0,0.0,0.0,0.0,0.0,0.0,0.0,0.0,0.0,0.0,0.0,0.0,0.0,0.0,0.0,0.0,0.0,0.0,0.0,0.0,0.0,0.0,0.0,0.0,0.0,0.0,0.0,0.0,0.0,0.0,0.0,0.0,0.0,0.0,0.0,0.0,0.0,0.0,0.0,0.0,0.0,0.0,0.0,0.0,0.0,0.0,0.0,0.0,0.0,0.0,0.0,0.0,0.0,0.0,0.0,0.0,0.0,0.0,0.0,0.0,0.0,0.0,0.0,0.0,0.0,0.0,0.0,0.0,0.0,0.0,0.0,0.0,0.0,0.0,0.0,0.0,0.0,0.0,0.0,0.0,0.0,0.0,0.0,0.0,0.0,0.0,0.0,0.0,0.0,0.0,0.0,0.0,0.0,0.0,0.0,0.0,0.0,0.0,0.0,0.0,0.0,0.0,0.0
"('savonniere', '06.08.2022')",Savonnière,2022-08-06,0,0.0,Petit lac,0.25088644085149364,0.20109664452740322,0.13525726361383164,0.1406813550505297,0.1417224503310724,0.09234063936990548,0.09048022696667041,0.09470717852014171,0.06669009565900856,0.0766154517928185,0.07115533098049315,0.05300191714918148,0.050309611013413746,0.032958679243266654,0.017286157767884818,0.017316675608425754,0.017725091822240933,0.01727424322099934,0.01686463364967079,0.01643900677596853,0.017709054747084705,0.01805345514388342,0.018459564213096226,0.018217972463836194,0.019539661643931956,0.015341189087781325,0.01742113838867753,0.021351506825431202,0.019169442788193786,0.019791217058523946,0.0,0.0,0.0,0.0,0.0,0.0,0.0,0.0,0.0,0.0,0.0,0.0,0.0,0.0,0.0,0.0,0.0,0.0,0.0,0.0,0.0,0.0,0.0,0.0,0.0,0.0,0.0,0.0,0.0,0.0,0.0,0.0,0.0,0.0,0.0,0.0,0.0,0.0,0.0,0.0,0.0,0.0,0.0,0.0,0.0,0.0,0.0,0.0,0.0,0.0,0.0,0.0,0.0,0.0,0.0,0.0,0.0,0.0,0.0,0.0,0.0,0.0,0.0,0.0,0.0,0.0,0.0,0.0,0.0,0.0,0.0,0.0,0.0,0.0,0.0,0.0,0.0,0.0,0.0,0.0,0.0,0.0,0.0,0.0,0.0,0.0,0.0,0.0,0.0,0.0,0.0,0.0,0.0,0.0,0.0,0.0,0.0,0.0,0.0,0.0,0.0,0.0,0.0,0.0,0.0,0.0,0.0,0.0,0.0,0.0,0.0,0.0,0.0,0.0,0.0,0.0,0.0,0.0,0.0,0.0,0.0,0.0,0.0,0.0,0.0,0.0,0.0,0.0,0.0,0.0,0.0,0.0,0.0,0.0
"('savonniere', '06.11.2022')",Savonnière,2022-11-06,0,0.0,Petit lac,0.25088644085149364,0.20109664452740322,0.13525726361383164,0.1406813550505297,0.1417224503310724,0.09234063936990548,0.09048022696667041,0.09470717852014171,0.06669009565900856,0.0766154517928185,0.07115533098049315,0.05300191714918148,0.050309611013413746,0.032958679243266654,0.017286157767884818,0.017316675608425754,0.017725091822240933,0.01727424322099934,0.01686463364967079,0.01643900677596853,0.017709054747084705,0.01805345514388342,0.018459564213096226,0.018217972463836194,0.019539661643931956,0.015341189087781325,0.01742113838867753,0.021351506825431202,0.019169442788193786,0.019791217058523946,0.0,0.0,0.0,0.0,0.0,0.0,0.0,0.0,0.0,0.0,0.0,0.0,0.0,0.0,0.0,0.0,0.0,0.0,0.0,0.0,0.0,0.0,0.0,0.0,0.0,0.0,0.0,0.0,0.0,0.0,0.0,0.0,0.0,0.0,0.0,0.0,0.0,0.0,0.0,0.0,0.0,0.0,0.0,0.0,0.0,0.0,0.0,0.0,0.0,0.0,0.0,0.0,0.0,0.0,0.0,0.0,0.0,0.0,0.0,0.0,0.0,0.0,0.0,0.0,0.0,0.0,0.0,0.0,0.0,0.0,0.0,0.0,0.0,0.0,0.0,0.0,0.0,0.0,0.0,0.0,0.0,0.0,0.0,0.0,0.0,0.0,0.0,0.0,0.0,0.0,0.0,0.0,0.0,0.0,0.0,0.0,0.0,0.0,0.0,0.0,0.0,0.0,0.0,0.0,0.0,0.0,0.0,0.0,0.0,0.0,0.0,0.0,0.0,0.0,0.0,0.0,0.0,0.0,0.0,0.0,0.0,0.0,0.0,0.0,0.0,0.0,0.0,0.0,0.0,0.0,0.0,0.0,0.0,0.0
"('tolochenaz', '01.05.2022')",Tolochenaz,2022-05-01,0,0.0,Grand lac,0.37659768214859385,0.37116540559001904,0.32062289604341765,0.23135208044965797,0.1825787499122583,0.14864064483815642,0.14124995869815873,0.10271449356329329,0.11010605035818469,0.10548186783385015,0.10102493854044224,0.10367743028446792,0.08679076107526087,0.06499205741253355,0.0470223372239593,0.052705288754361715,0.052867925736533386,0.027953068395873557,0.03665653178351209,0.03422791979709275,0.035808143716527095,0.03499386380037143,0.0,0.0,0.0,0.0,0.0,0.0,0.0,0.0,0.0,0.0,0.0,0.0,0.0,0.0,0.0,0.0,0.0,0.0,0.0,0.0,0.0,0.0,0.0,0.0,0.0,0.0,0.0,0.0,0.0,0.0,0.0,0.0,0.0,0.0,0.0,0.0,0.0,0.0,0.0,0.0,0.0,0.0,0.0,0.0,0.0,0.0,0.0,0.0,0.0,0.0,0.0,0.0,0.0,0.0,0.0,0.0,0.0,0.0,0.0,0.0,0.0,0.0,0.0,0.0,0.0,0.0,0.0,0.0,0.0,0.0,0.0,0.0,0.0,0.0,0.0,0.0,0.0,0.0,0.0,0.0,0.0,0.0,0.0,0.0,0.0,0.0,0.0,0.0,0.0,0.0,0.0,0.0,0.0,0.0,0.0,0.0,0.0,0.0,0.0,0.0,0.0,0.0,0.0,0.0,0.0,0.0,0.0,0.0,0.0,0.0,0.0,0.0,0.0,0.0,0.0,0.0,0.0,0.0,0.0,0.0,0.0,0.0,0.0,0.0,0.0,0.0,0.0,0.0,0.0,0.0,0.0,0.0,0.0,0.0,0.0,0.0,0.0,0.0,0.0,0.0,0.0,0.0
"('tolochenaz', '07.02.2022')",Tolochenaz,2022-02-07,0,0.0,Grand lac,0.37659768214859385,0.37116540559001904,0.32062289604341765,0.23135208044965797,0.1825787499122583,0.14864064483815642,0.14124995869815873,0.10271449356329329,0.11010605035818469,0.10548186783385015,0.10102493854044224,0.10367743028446792,0.08679076107526087,0.06499205741253355,0.0470223372239593,0.052705288754361715,0.052867925736533386,0.027953068395873557,0.03665653178351209,0.03422791979709275,0.035808143716527095,0.03499386380037143,0.0,0.0,0.0,0.0,0.0,0.0,0.0,0.0,0.0,0.0,0.0,0.0,0.0,0.0,0.0,0.0,0.0,0.0,0.0,0.0,0.0,0.0,0.0,0.0,0.0,0.0,0.0,0.0,0.0,0.0,0.0,0.0,0.0,0.0,0.0,0.0,0.0,0.0,0.0,0.0,0.0,0.0,0.0,0.0,0.0,0.0,0.0,0.0,0.0,0.0,0.0,0.0,0.0,0.0,0.0,0.0,0.0,0.0,0.0,0.0,0.0,0.0,0.0,0.0,0.0,0.0,0.0,0.0,0.0,0.0,0.0,0.0,0.0,0.0,0.0,0.0,0.0,0.0,0.0,0.0,0.0,0.0,0.0,0.0,0.0,0.0,0.0,0.0,0.0,0.0,0.0,0.0,0.0,0.0,0.0,0.0,0.0,0.0,0.0,0.0,0.0,0.0,0.0,0.0,0.0,0.0,0.0,0.0,0.0,0.0,0.0,0.0,0.0,0.0,0.0,0.0,0.0,0.0,0.0,0.0,0.0,0.0,0.0,0.0,0.0,0.0,0.0,0.0,0.0,0.0,0.0,0.0,0.0,0.0,0.0,0.0,0.0,0.0,0.0,0.0,0.0,0.0
"('tolochenaz', '12.11.2022')",Tolochenaz,2022-11-12,0,0.0,Grand lac,0.37659768214859385,0.37116540559001904,0.32062289604341765,0.23135208044965797,0.1825787499122583,0.14864064483815642,0.14124995869815873,0.10271449356329329,0.11010605035818469,0.10548186783385015,0.10102493854044224,0.10367743028446792,0.08679076107526087,0.06499205741253355,0.0470223372239593,0.052705288754361715,0.052867925736533386,0.027953068395873557,0.03665653178351209,0.03422791979709275,0.035808143716527095,0.03499386380037143,0.0,0.0,0.0,0.0,0.0,0.0,0.0,0.0,0.0,0.0,0.0,0.0,0.0,0.0,0.0,0.0,0.0,0.0,0.0,0.0,0.0,0.0,0.0,0.0,0.0,0.0,0.0,0.0,0.0,0.0,0.0,0.0,0.0,0.0,0.0,0.0,0.0,0.0,0.0,0.0,0.0,0.0,0.0,0.0,0.0,0.0,0.0,0.0,0.0,0.0,0.0,0.0,0.0,0.0,0.0,0.0,0.0,0.0,0.0,0.0,0.0,0.0,0.0,0.0,0.0,0.0,0.0,0.0,0.0,0.0,0.0,0.0,0.0,0.0,0.0,0.0,0.0,0.0,0.0,0.0,0.0,0.0,0.0,0.0,0.0,0.0,0.0,0.0,0.0,0.0,0.0,0.0,0.0,0.0,0.0,0.0,0.0,0.0,0.0,0.0,0.0,0.0,0.0,0.0,0.0,0.0,0.0,0.0,0.0,0.0,0.0,0.0,0.0,0.0,0.0,0.0,0.0,0.0,0.0,0.0,0.0,0.0,0.0,0.0,0.0,0.0,0.0,0.0,0.0,0.0,0.0,0.0,0.0,0.0,0.0,0.0,0.0,0.0,0.0,0.0,0.0,0.0
"('tolochenaz', '21.08.2022')",Tolochenaz,2022-08-21,0,0.0,Grand lac,0.37659768214859385,0.37116540559001904,0.32062289604341765,0.23135208044965797,0.1825787499122583,0.14864064483815642,0.14124995869815873,0.10271449356329329,0.11010605035818469,0.10548186783385015,0.10102493854044224,0.10367743028446792,0.08679076107526087,0.06499205741253355,0.0470223372239593,0.052705288754361715,0.052867925736533386,0.027953068395873557,0.03665653178351209,0.03422791979709275,0.035808143716527095,0.03499386380037143,0.0,0.0,0.0,0.0,0.0,0.0,0.0,0.0,0.0,0.0,0.0,0.0,0.0,0.0,0.0,0.0,0.0,0.0,0.0,0.0,0.0,0.0,0.0,0.0,0.0,0.0,0.0,0.0,0.0,0.0,0.0,0.0,0.0,0.0,0.0,0.0,0.0,0.0,0.0,0.0,0.0,0.0,0.0,0.0,0.0,0.0,0.0,0.0,0.0,0.0,0.0,0.0,0.0,0.0,0.0,0.0,0.0,0.0,0.0,0.0,0.0,0.0,0.0,0.0,0.0,0.0,0.0,0.0,0.0,0.0,0.0,0.0,0.0,0.0,0.0,0.0,0.0,0.0,0.0,0.0,0.0,0.0,0.0,0.0,0.0,0.0,0.0,0.0,0.0,0.0,0.0,0.0,0.0,0.0,0.0,0.0,0.0,0.0,0.0,0.0,0.0,0.0,0.0,0.0,0.0,0.0,0.0,0.0,0.0,0.0,0.0,0.0,0.0,0.0,0.0,0.0,0.0,0.0,0.0,0.0,0.0,0.0,0.0,0.0,0.0,0.0,0.0,0.0,0.0,0.0,0.0,0.0,0.0,0.0,0.0,0.0,0.0,0.0,0.0,0.0,0.0,0.0
"('tougues', '07.05.2022')",Tougues,2022-05-07,0,0.0,Petit lac,0.25088644085149364,0.20109664452740322,0.13525726361383164,0.1406813550505297,0.1417224503310724,0.09234063936990548,0.09048022696667041,0.09470717852014171,0.06669009565900856,0.0766154517928185,0.07115533098049315,0.05300191714918148,0.050309611013413746,0.032958679243266654,0.017286157767884818,0.017316675608425754,0.017725091822240933,0.01727424322099934,0.01686463364967079,0.01643900677596853,0.017709054747084705,0.01805345514388342,0.018459564213096226,0.018217972463836194,0.019539661643931956,0.015341189087781325,0.01742113838867753,0.021351506825431202,0.019169442788193786,0.019791217058523946,0.0,0.0,0.0,0.0,0.0,0.0,0.0,0.0,0.0,0.0,0.0,0.0,0.0,0.0,0.0,0.0,0.0,0.0,0.0,0.0,0.0,0.0,0.0,0.0,0.0,0.0,0.0,0.0,0.0,0.0,0.0,0.0,0.0,0.0,0.0,0.0,0.0,0.0,0.0,0.0,0.0,0.0,0.0,0.0,0.0,0.0,0.0,0.0,0.0,0.0,0.0,0.0,0.0,0.0,0.0,0.0,0.0,0.0,0.0,0.0,0.0,0.0,0.0,0.0,0.0,0.0,0.0,0.0,0.0,0.0,0.0,0.0,0.0,0.0,0.0,0.0,0.0,0.0,0.0,0.0,0.0,0.0,0.0,0.0,0.0,0.0,0.0,0.0,0.0,0.0,0.0,0.0,0.0,0.0,0.0,0.0,0.0,0.0,0.0,0.0,0.0,0.0,0.0,0.0,0.0,0.0,0.0,0.0,0.0,0.0,0.0,0.0,0.0,0.0,0.0,0.0,0.0,0.0,0.0,0.0,0.0,0.0,0.0,0.0,0.0,0.0,0.0,0.0,0.0,0.0,0.0,0.0,0.0,0.0
"('tougues', '10.08.2022')",Tougues,2022-08-10,0,0.0,Petit lac,0.25088644085149364,0.20109664452740322,0.13525726361383164,0.1406813550505297,0.1417224503310724,0.09234063936990548,0.09048022696667041,0.09470717852014171,0.06669009565900856,0.0766154517928185,0.07115533098049315,0.05300191714918148,0.050309611013413746,0.032958679243266654,0.017286157767884818,0.017316675608425754,0.017725091822240933,0.01727424322099934,0.01686463364967079,0.01643900677596853,0.017709054747084705,0.01805345514388342,0.018459564213096226,0.018217972463836194,0.019539661643931956,0.015341189087781325,0.01742113838867753,0.021351506825431202,0.019169442788193786,0.019791217058523946,0.0,0.0,0.0,0.0,0.0,0.0,0.0,0.0,0.0,0.0,0.0,0.0,0.0,0.0,0.0,0.0,0.0,0.0,0.0,0.0,0.0,0.0,0.0,0.0,0.0,0.0,0.0,0.0,0.0,0.0,0.0,0.0,0.0,0.0,0.0,0.0,0.0,0.0,0.0,0.0,0.0,0.0,0.0,0.0,0.0,0.0,0.0,0.0,0.0,0.0,0.0,0.0,0.0,0.0,0.0,0.0,0.0,0.0,0.0,0.0,0.0,0.0,0.0,0.0,0.0,0.0,0.0,0.0,0.0,0.0,0.0,0.0,0.0,0.0,0.0,0.0,0.0,0.0,0.0,0.0,0.0,0.0,0.0,0.0,0.0,0.0,0.0,0.0,0.0,0.0,0.0,0.0,0.0,0.0,0.0,0.0,0.0,0.0,0.0,0.0,0.0,0.0,0.0,0.0,0.0,0.0,0.0,0.0,0.0,0.0,0.0,0.0,0.0,0.0,0.0,0.0,0.0,0.0,0.0,0.0,0.0,0.0,0.0,0.0,0.0,0.0,0.0,0.0,0.0,0.0,0.0,0.0,0.0,0.0
"('tougues', '22.10.2022')",Tougues,2022-10-22,0,0.0,Petit lac,0.25088644085149364,0.20109664452740322,0.13525726361383164,0.1406813550505297,0.1417224503310724,0.09234063936990548,0.09048022696667041,0.09470717852014171,0.06669009565900856,0.0766154517928185,0.07115533098049315,0.05300191714918148,0.050309611013413746,0.032958679243266654,0.017286157767884818,0.017316675608425754,0.017725091822240933,0.01727424322099934,0.01686463364967079,0.01643900677596853,0.017709054747084705,0.01805345514388342,0.018459564213096226,0.018217972463836194,0.019539661643931956,0.015341189087781325,0.01742113838867753,0.021351506825431202,0.019169442788193786,0.019791217058523946,0.0,0.0,0.0,0.0,0.0,0.0,0.0,0.0,0.0,0.0,0.0,0.0,0.0,0.0,0.0,0.0,0.0,0.0,0.0,0.0,0.0,0.0,0.0,0.0,0.0,0.0,0.0,0.0,0.0,0.0,0.0,0.0,0.0,0.0,0.0,0.0,0.0,0.0,0.0,0.0,0.0,0.0,0.0,0.0,0.0,0.0,0.0,0.0,0.0,0.0,0.0,0.0,0.0,0.0,0.0,0.0,0.0,0.0,0.0,0.0,0.0,0.0,0.0,0.0,0.0,0.0,0.0,0.0,0.0,0.0,0.0,0.0,0.0,0.0,0.0,0.0,0.0,0.0,0.0,0.0,0.0,0.0,0.0,0.0,0.0,0.0,0.0,0.0,0.0,0.0,0.0,0.0,0.0,0.0,0.0,0.0,0.0,0.0,0.0,0.0,0.0,0.0,0.0,0.0,0.0,0.0,0.0,0.0,0.0,0.0,0.0,0.0,0.0,0.0,0.0,0.0,0.0,0.0,0.0,0.0,0.0,0.0,0.0,0.0,0.0,0.0,0.0,0.0,0.0,0.0,0.0,0.0,0.0,0.0
"('tougues', '29.01.2022')",Tougues,2022-01-29,0,0.0,Petit lac,0.25088644085149364,0.20109664452740322,0.13525726361383164,0.1406813550505297,0.1417224503310724,0.09234063936990548,0.09048022696667041,0.09470717852014171,0.06669009565900856,0.0766154517928185,0.07115533098049315,0.05300191714918148,0.050309611013413746,0.032958679243266654,0.017286157767884818,0.017316675608425754,0.017725091822240933,0.01727424322099934,0.01686463364967079,0.01643900677596853,0.017709054747084705,0.01805345514388342,0.018459564213096226,0.018217972463836194,0.019539661643931956,0.015341189087781325,0.01742113838867753,0.021351506825431202,0.019169442788193786,0.019791217058523946,0.0,0.0,0.0,0.0,0.0,0.0,0.0,0.0,0.0,0.0,0.0,0.0,0.0,0.0,0.0,0.0,0.0,0.0,0.0,0.0,0.0,0.0,0.0,0.0,0.0,0.0,0.0,0.0,0.0,0.0,0.0,0.0,0.0,0.0,0.0,0.0,0.0,0.0,0.0,0.0,0.0,0.0,0.0,0.0,0.0,0.0,0.0,0.0,0.0,0.0,0.0,0.0,0.0,0.0,0.0,0.0,0.0,0.0,0.0,0.0,0.0,0.0,0.0,0.0,0.0,0.0,0.0,0.0,0.0,0.0,0.0,0.0,0.0,0.0,0.0,0.0,0.0,0.0,0.0,0.0,0.0,0.0,0.0,0.0,0.0,0.0,0.0,0.0,0.0,0.0,0.0,0.0,0.0,0.0,0.0,0.0,0.0,0.0,0.0,0.0,0.0,0.0,0.0,0.0,0.0,0.0,0.0,0.0,0.0,0.0,0.0,0.0,0.0,0.0,0.0,0.0,0.0,0.0,0.0,0.0,0.0,0.0,0.0,0.0,0.0,0.0,0.0,0.0,0.0,0.0,0.0,0.0,0.0,0.0
"('versoix', '14.08.2022')",Versoix,2022-08-14,0,0.0,Petit lac,0.25088644085149364,0.20109664452740322,0.13525726361383164,0.1406813550505297,0.1417224503310724,0.09234063936990548,0.09048022696667041,0.09470717852014171,0.06669009565900856,0.0766154517928185,0.07115533098049315,0.05300191714918148,0.050309611013413746,0.032958679243266654,0.017286157767884818,0.017316675608425754,0.017725091822240933,0.01727424322099934,0.01686463364967079,0.01643900677596853,0.017709054747084705,0.01805345514388342,0.018459564213096226,0.018217972463836194,0.019539661643931956,0.015341189087781325,0.01742113838867753,0.021351506825431202,0.019169442788193786,0.019791217058523946,0.0,0.0,0.0,0.0,0.0,0.0,0.0,0.0,0.0,0.0,0.0,0.0,0.0,0.0,0.0,0.0,0.0,0.0,0.0,0.0,0.0,0.0,0.0,0.0,0.0,0.0,0.0,0.0,0.0,0.0,0.0,0.0,0.0,0.0,0.0,0.0,0.0,0.0,0.0,0.0,0.0,0.0,0.0,0.0,0.0,0.0,0.0,0.0,0.0,0.0,0.0,0.0,0.0,0.0,0.0,0.0,0.0,0.0,0.0,0.0,0.0,0.0,0.0,0.0,0.0,0.0,0.0,0.0,0.0,0.0,0.0,0.0,0.0,0.0,0.0,0.0,0.0,0.0,0.0,0.0,0.0,0.0,0.0,0.0,0.0,0.0,0.0,0.0,0.0,0.0,0.0,0.0,0.0,0.0,0.0,0.0,0.0,0.0,0.0,0.0,0.0,0.0,0.0,0.0,0.0,0.0,0.0,0.0,0.0,0.0,0.0,0.0,0.0,0.0,0.0,0.0,0.0,0.0,0.0,0.0,0.0,0.0,0.0,0.0,0.0,0.0,0.0,0.0,0.0,0.0,0.0,0.0,0.0,0.0
"('versoix', '15.10.2022')",Versoix,2022-10-15,0,0.0,Petit lac,0.25088644085149364,0.20109664452740322,0.13525726361383164,0.1406813550505297,0.1417224503310724,0.09234063936990548,0.09048022696667041,0.09470717852014171,0.06669009565900856,0.0766154517928185,0.07115533098049315,0.05300191714918148,0.050309611013413746,0.032958679243266654,0.017286157767884818,0.017316675608425754,0.017725091822240933,0.01727424322099934,0.01686463364967079,0.01643900677596853,0.017709054747084705,0.01805345514388342,0.018459564213096226,0.018217972463836194,0.019539661643931956,0.015341189087781325,0.01742113838867753,0.021351506825431202,0.019169442788193786,0.019791217058523946,0.0,0.0,0.0,0.0,0.0,0.0,0.0,0.0,0.0,0.0,0.0,0.0,0.0,0.0,0.0,0.0,0.0,0.0,0.0,0.0,0.0,0.0,0.0,0.0,0.0,0.0,0.0,0.0,0.0,0.0,0.0,0.0,0.0,0.0,0.0,0.0,0.0,0.0,0.0,0.0,0.0,0.0,0.0,0.0,0.0,0.0,0.0,0.0,0.0,0.0,0.0,0.0,0.0,0.0,0.0,0.0,0.0,0.0,0.0,0.0,0.0,0.0,0.0,0.0,0.0,0.0,0.0,0.0,0.0,0.0,0.0,0.0,0.0,0.0,0.0,0.0,0.0,0.0,0.0,0.0,0.0,0.0,0.0,0.0,0.0,0.0,0.0,0.0,0.0,0.0,0.0,0.0,0.0,0.0,0.0,0.0,0.0,0.0,0.0,0.0,0.0,0.0,0.0,0.0,0.0,0.0,0.0,0.0,0.0,0.0,0.0,0.0,0.0,0.0,0.0,0.0,0.0,0.0,0.0,0.0,0.0,0.0,0.0,0.0,0.0,0.0,0.0,0.0,0.0,0.0,0.0,0.0,0.0,0.0
"('versoix', '2/5/2022')",Versoix,2022-05-02,0,0.0,Petit lac,0.25088644085149364,0.20109664452740322,0.13525726361383164,0.1406813550505297,0.1417224503310724,0.09234063936990548,0.09048022696667041,0.09470717852014171,0.06669009565900856,0.0766154517928185,0.07115533098049315,0.05300191714918148,0.050309611013413746,0.032958679243266654,0.017286157767884818,0.017316675608425754,0.017725091822240933,0.01727424322099934,0.01686463364967079,0.01643900677596853,0.017709054747084705,0.01805345514388342,0.018459564213096226,0.018217972463836194,0.019539661643931956,0.015341189087781325,0.01742113838867753,0.021351506825431202,0.019169442788193786,0.019791217058523946,0.0,0.0,0.0,0.0,0.0,0.0,0.0,0.0,0.0,0.0,0.0,0.0,0.0,0.0,0.0,0.0,0.0,0.0,0.0,0.0,0.0,0.0,0.0,0.0,0.0,0.0,0.0,0.0,0.0,0.0,0.0,0.0,0.0,0.0,0.0,0.0,0.0,0.0,0.0,0.0,0.0,0.0,0.0,0.0,0.0,0.0,0.0,0.0,0.0,0.0,0.0,0.0,0.0,0.0,0.0,0.0,0.0,0.0,0.0,0.0,0.0,0.0,0.0,0.0,0.0,0.0,0.0,0.0,0.0,0.0,0.0,0.0,0.0,0.0,0.0,0.0,0.0,0.0,0.0,0.0,0.0,0.0,0.0,0.0,0.0,0.0,0.0,0.0,0.0,0.0,0.0,0.0,0.0,0.0,0.0,0.0,0.0,0.0,0.0,0.0,0.0,0.0,0.0,0.0,0.0,0.0,0.0,0.0,0.0,0.0,0.0,0.0,0.0,0.0,0.0,0.0,0.0,0.0,0.0,0.0,0.0,0.0,0.0,0.0,0.0,0.0,0.0,0.0,0.0,0.0,0.0,0.0,0.0,0.0
"('versoix', '30.04.2022')",Versoix,2022-04-30,0,0.0,Petit lac,0.25088644085149364,0.20109664452740322,0.13525726361383164,0.1406813550505297,0.1417224503310724,0.09234063936990548,0.09048022696667041,0.09470717852014171,0.06669009565900856,0.0766154517928185,0.07115533098049315,0.05300191714918148,0.050309611013413746,0.032958679243266654,0.017286157767884818,0.017316675608425754,0.017725091822240933,0.01727424322099934,0.01686463364967079,0.01643900677596853,0.017709054747084705,0.01805345514388342,0.018459564213096226,0.018217972463836194,0.019539661643931956,0.015341189087781325,0.01742113838867753,0.021351506825431202,0.019169442788193786,0.019791217058523946,0.0,0.0,0.0,0.0,0.0,0.0,0.0,0.0,0.0,0.0,0.0,0.0,0.0,0.0,0.0,0.0,0.0,0.0,0.0,0.0,0.0,0.0,0.0,0.0,0.0,0.0,0.0,0.0,0.0,0.0,0.0,0.0,0.0,0.0,0.0,0.0,0.0,0.0,0.0,0.0,0.0,0.0,0.0,0.0,0.0,0.0,0.0,0.0,0.0,0.0,0.0,0.0,0.0,0.0,0.0,0.0,0.0,0.0,0.0,0.0,0.0,0.0,0.0,0.0,0.0,0.0,0.0,0.0,0.0,0.0,0.0,0.0,0.0,0.0,0.0,0.0,0.0,0.0,0.0,0.0,0.0,0.0,0.0,0.0,0.0,0.0,0.0,0.0,0.0,0.0,0.0,0.0,0.0,0.0,0.0,0.0,0.0,0.0,0.0,0.0,0.0,0.0,0.0,0.0,0.0,0.0,0.0,0.0,0.0,0.0,0.0,0.0,0.0,0.0,0.0,0.0,0.0,0.0,0.0,0.0,0.0,0.0,0.0,0.0,0.0,0.0,0.0,0.0,0.0,0.0,0.0,0.0,0.0,0.0
"('amphion', '01.02.2022')",Amphion,2022-02-01,33,0.3626373626373626,Grand lac,0.37659768214859385,0.37116540559001904,0.32062289604341765,0.23135208044965797,0.1825787499122583,0.14864064483815642,0.14124995869815873,0.10271449356329329,0.11010605035818469,0.10548186783385015,0.10102493854044224,0.10367743028446792,0.08679076107526087,0.06499205741253355,0.0470223372239593,0.052705288754361715,0.052867925736533386,0.027953068395873557,0.03665653178351209,0.03422791979709275,0.035808143716527095,0.03499386380037143,0.0,0.0,0.0,0.0,0.0,0.0,0.0,0.0,0.0,0.0,0.0,0.0,0.0,0.0,0.0,0.0,0.0,0.0,0.0,0.0,0.0,0.0,0.0,0.0,0.0,0.0,0.0,0.0,0.0,0.0,0.0,0.0,0.0,0.0,0.0,0.0,0.0,0.0,0.0,0.0,0.0,0.0,0.0,0.0,0.0,0.0,0.0,0.0,0.0,0.0,0.0,0.0,0.0,0.0,0.0,0.0,0.0,0.0,0.0,0.0,0.0,0.0,0.0,0.0,0.0,0.0,0.0,0.0,0.0,0.0,0.0,0.0,0.0,0.0,0.0,0.0,0.0,0.0,0.0,0.0,0.0,0.0,0.0,0.0,0.0,0.0,0.0,0.0,0.0,0.0,0.0,0.0,0.0,0.0,0.0,0.0,0.0,0.0,0.0,0.0,0.0,0.0,0.0,0.0,0.0,0.0,0.0,0.0,0.0,0.0,0.0,0.0,0.0,0.0,0.0,0.0,0.0,0.0,0.0,0.0,0.0,0.0,0.0,0.0,0.0,0.0,0.0,0.0,0.0,0.0,0.0,0.0,0.0,0.0,0.0,0.0,0.0,0.0,0.0,0.0,0.0,0.0
"('amphion', '03.05.2022')",Amphion,2022-05-03,12,0.1318681318681318,Grand lac,0.37659768214859385,0.37116540559001904,0.32062289604341765,0.23135208044965797,0.1825787499122583,0.14864064483815642,0.14124995869815873,0.10271449356329329,0.11010605035818469,0.10548186783385015,0.10102493854044224,0.10367743028446792,0.08679076107526087,0.06499205741253355,0.0470223372239593,0.052705288754361715,0.052867925736533386,0.027953068395873557,0.03665653178351209,0.03422791979709275,0.035808143716527095,0.03499386380037143,0.0,0.0,0.0,0.0,0.0,0.0,0.0,0.0,0.0,0.0,0.0,0.0,0.0,0.0,0.0,0.0,0.0,0.0,0.0,0.0,0.0,0.0,0.0,0.0,0.0,0.0,0.0,0.0,0.0,0.0,0.0,0.0,0.0,0.0,0.0,0.0,0.0,0.0,0.0,0.0,0.0,0.0,0.0,0.0,0.0,0.0,0.0,0.0,0.0,0.0,0.0,0.0,0.0,0.0,0.0,0.0,0.0,0.0,0.0,0.0,0.0,0.0,0.0,0.0,0.0,0.0,0.0,0.0,0.0,0.0,0.0,0.0,0.0,0.0,0.0,0.0,0.0,0.0,0.0,0.0,0.0,0.0,0.0,0.0,0.0,0.0,0.0,0.0,0.0,0.0,0.0,0.0,0.0,0.0,0.0,0.0,0.0,0.0,0.0,0.0,0.0,0.0,0.0,0.0,0.0,0.0,0.0,0.0,0.0,0.0,0.0,0.0,0.0,0.0,0.0,0.0,0.0,0.0,0.0,0.0,0.0,0.0,0.0,0.0,0.0,0.0,0.0,0.0,0.0,0.0,0.0,0.0,0.0,0.0,0.0,0.0,0.0,0.0,0.0,0.0,0.0,0.0
"('amphion', '18.10.2022')",Amphion,2022-10-18,5,0.0549450549450549,Grand lac,0.37659768214859385,0.37116540559001904,0.32062289604341765,0.23135208044965797,0.1825787499122583,0.14864064483815642,0.14124995869815873,0.10271449356329329,0.11010605035818469,0.10548186783385015,0.10102493854044224,0.10367743028446792,0.08679076107526087,0.06499205741253355,0.0470223372239593,0.052705288754361715,0.052867925736533386,0.027953068395873557,0.03665653178351209,0.03422791979709275,0.035808143716527095,0.03499386380037143,0.0,0.0,0.0,0.0,0.0,0.0,0.0,0.0,0.0,0.0,0.0,0.0,0.0,0.0,0.0,0.0,0.0,0.0,0.0,0.0,0.0,0.0,0.0,0.0,0.0,0.0,0.0,0.0,0.0,0.0,0.0,0.0,0.0,0.0,0.0,0.0,0.0,0.0,0.0,0.0,0.0,0.0,0.0,0.0,0.0,0.0,0.0,0.0,0.0,0.0,0.0,0.0,0.0,0.0,0.0,0.0,0.0,0.0,0.0,0.0,0.0,0.0,0.0,0.0,0.0,0.0,0.0,0.0,0.0,0.0,0.0,0.0,0.0,0.0,0.0,0.0,0.0,0.0,0.0,0.0,0.0,0.0,0.0,0.0,0.0,0.0,0.0,0.0,0.0,0.0,0.0,0.0,0.0,0.0,0.0,0.0,0.0,0.0,0.0,0.0,0.0,0.0,0.0,0.0,0.0,0.0,0.0,0.0,0.0,0.0,0.0,0.0,0.0,0.0,0.0,0.0,0.0,0.0,0.0,0.0,0.0,0.0,0.0,0.0,0.0,0.0,0.0,0.0,0.0,0.0,0.0,0.0,0.0,0.0,0.0,0.0,0.0,0.0,0.0,0.0,0.0,0.0
"('amphion', '19.07.2022')",Amphion,2022-07-19,12,0.1318681318681318,Grand lac,0.37659768214859385,0.37116540559001904,0.32062289604341765,0.23135208044965797,0.1825787499122583,0.14864064483815642,0.14124995869815873,0.10271449356329329,0.11010605035818469,0.10548186783385015,0.10102493854044224,0.10367743028446792,0.08679076107526087,0.06499205741253355,0.0470223372239593,0.052705288754361715,0.052867925736533386,0.027953068395873557,0.03665653178351209,0.03422791979709275,0.035808143716527095,0.03499386380037143,0.0,0.0,0.0,0.0,0.0,0.0,0.0,0.0,0.0,0.0,0.0,0.0,0.0,0.0,0.0,0.0,0.0,0.0,0.0,0.0,0.0,0.0,0.0,0.0,0.0,0.0,0.0,0.0,0.0,0.0,0.0,0.0,0.0,0.0,0.0,0.0,0.0,0.0,0.0,0.0,0.0,0.0,0.0,0.0,0.0,0.0,0.0,0.0,0.0,0.0,0.0,0.0,0.0,0.0,0.0,0.0,0.0,0.0,0.0,0.0,0.0,0.0,0.0,0.0,0.0,0.0,0.0,0.0,0.0,0.0,0.0,0.0,0.0,0.0,0.0,0.0,0.0,0.0,0.0,0.0,0.0,0.0,0.0,0.0,0.0,0.0,0.0,0.0,0.0,0.0,0.0,0.0,0.0,0.0,0.0,0.0,0.0,0.0,0.0,0.0,0.0,0.0,0.0,0.0,0.0,0.0,0.0,0.0,0.0,0.0,0.0,0.0,0.0,0.0,0.0,0.0,0.0,0.0,0.0,0.0,0.0,0.0,0.0,0.0,0.0,0.0,0.0,0.0,0.0,0.0,0.0,0.0,0.0,0.0,0.0,0.0,0.0,0.0,0.0,0.0,0.0,0.0
"('baby-plage', '22.01.2022')",Baby Plage,2022-01-22,3,0.037037037037037,Petit lac,0.25088644085149364,0.20109664452740322,0.13525726361383164,0.1406813550505297,0.1417224503310724,0.09234063936990548,0.09048022696667041,0.09470717852014171,0.06669009565900856,0.0766154517928185,0.07115533098049315,0.05300191714918148,0.050309611013413746,0.032958679243266654,0.017286157767884818,0.017316675608425754,0.017725091822240933,0.01727424322099934,0.01686463364967079,0.01643900677596853,0.017709054747084705,0.01805345514388342,0.018459564213096226,0.018217972463836194,0.019539661643931956,0.015341189087781325,0.01742113838867753,0.021351506825431202,0.019169442788193786,0.019791217058523946,0.0,0.0,0.0,0.0,0.0,0.0,0.0,0.0,0.0,0.0,0.0,0.0,0.0,0.0,0.0,0.0,0.0,0.0,0.0,0.0,0.0,0.0,0.0,0.0,0.0,0.0,0.0,0.0,0.0,0.0,0.0,0.0,0.0,0.0,0.0,0.0,0.0,0.0,0.0,0.0,0.0,0.0,0.0,0.0,0.0,0.0,0.0,0.0,0.0,0.0,0.0,0.0,0.0,0.0,0.0,0.0,0.0,0.0,0.0,0.0,0.0,0.0,0.0,0.0,0.0,0.0,0.0,0.0,0.0,0.0,0.0,0.0,0.0,0.0,0.0,0.0,0.0,0.0,0.0,0.0,0.0,0.0,0.0,0.0,0.0,0.0,0.0,0.0,0.0,0.0,0.0,0.0,0.0,0.0,0.0,0.0,0.0,0.0,0.0,0.0,0.0,0.0,0.0,0.0,0.0,0.0,0.0,0.0,0.0,0.0,0.0,0.0,0.0,0.0,0.0,0.0,0.0,0.0,0.0,0.0,0.0,0.0,0.0,0.0,0.0,0.0,0.0,0.0,0.0,0.0,0.0,0.0,0.0,0.0
"('bouveret', '03.09.2022')",Bouveret,2022-09-03,2,0.0172413793103448,Haut lac,0.7302797692049658,0.6999677024452676,0.6057567125840336,0.5352017498503865,0.5264214817367325,0.4340904197719102,0.42523065510491137,0.4122581083916993,0.3793644217936407,0.3500374710334708,0.34649679838981323,0.33140263491978544,0.31947746286079326,0.29411411087594663,0.27905203360764796,0.2762130034332507,0.2675156938245815,0.2359914086142253,0.23739478454494037,0.22062980721104034,0.21039339145187974,0.21093214308098443,0.1990377970561429,0.191805899057051,0.18171177988439413,0.1773815445095092,0.16558671241730544,0.15835489810784883,0.1482169954891922,0.15343383877784816,0.14196132295257216,0.14191287137647277,0.12966100164875566,0.13539463500616072,0.12822021175189932,0.12575122007672282,0.0,0.0,0.0,0.0,0.0,0.0,0.0,0.0,0.0,0.0,0.0,0.0,0.0,0.0,0.0,0.0,0.0,0.0,0.0,0.0,0.0,0.0,0.0,0.0,0.0,0.0,0.0,0.0,0.0,0.0,0.0,0.0,0.0,0.0,0.0,0.0,0.0,0.0,0.0,0.0,0.0,0.0,0.0,0.0,0.0,0.0,0.0,0.0,0.0,0.0,0.0,0.0,0.0,0.0,0.0,0.0,0.0,0.0,0.0,0.0,0.0,0.0,0.0,0.0,0.0,0.0,0.0,0.0,0.0,0.0,0.0,0.0,0.0,0.0,0.0,0.0,0.0,0.0,0.0,0.0,0.0,0.0,0.0,0.0,0.0,0.0,0.0,0.0,0.0,0.0,0.0,0.0,0.0,0.0,0.0,0.0,0.0,0.0,0.0,0.0,0.0,0.0,0.0,0.0,0.0,0.0,0.0,0.0,0.0,0.0,0.0,0.0,0.0,0.0,0.0,0.0,0.0,0.0,0.0,0.0,0.0,0.0,0.0,0.0,0.0,0.0,0.0,0.0
"('bouveret', '05.11.2022')",Bouveret,2022-11-05,5,0.043103448275862,Haut lac,0.7302797692049658,0.6999677024452676,0.6057567125840336,0.5352017498503865,0.5264214817367325,0.4340904197719102,0.42523065510491137,0.4122581083916993,0.3793644217936407,0.3500374710334708,0.34649679838981323,0.33140263491978544,0.31947746286079326,0.29411411087594663,0.27905203360764796,0.2762130034332507,0.2675156938245815,0.2359914086142253,0.23739478454494037,0.22062980721104034,0.21039339145187974,0.21093214308098443,0.1990377970561429,0.191805899057051,0.18171177988439413,0.1773815445095092,0.16558671241730544,0.15835489810784883,0.1482169954891922,0.15343383877784816,0.14196132295257216,0.14191287137647277,0.12966100164875566,0.13539463500616072,0.12822021175189932,0.12575122007672282,0.0,0.0,0.0,0.0,0.0,0.0,0.0,0.0,0.0,0.0,0.0,0.0,0.0,0.0,0.0,0.0,0.0,0.0,0.0,0.0,0.0,0.0,0.0,0.0,0.0,0.0,0.0,0.0,0.0,0.0,0.0,0.0,0.0,0.0,0.0,0.0,0.0,0.0,0.0,0.0,0.0,0.0,0.0,0.0,0.0,0.0,0.0,0.0,0.0,0.0,0.0,0.0,0.0,0.0,0.0,0.0,0.0,0.0,0.0,0.0,0.0,0.0,0.0,0.0,0.0,0.0,0.0,0.0,0.0,0.0,0.0,0.0,0.0,0.0,0.0,0.0,0.0,0.0,0.0,0.0,0.0,0.0,0.0,0.0,0.0,0.0,0.0,0.0,0.0,0.0,0.0,0.0,0.0,0.0,0.0,0.0,0.0,0.0,0.0,0.0,0.0,0.0,0.0,0.0,0.0,0.0,0.0,0.0,0.0,0.0,0.0,0.0,0.0,0.0,0.0,0.0,0.0,0.0,0.0,0.0,0.0,0.0,0.0,0.0,0.0,0.0,0.0,0.0
"('bouveret', '15.01.2022')",Bouveret,2022-01-15,34,0.293103448275862,Haut lac,0.7302797692049658,0.6999677024452676,0.6057567125840336,0.5352017498503865,0.5264214817367325,0.4340904197719102,0.42523065510491137,0.4122581083916993,0.3793644217936407,0.3500374710334708,0.34649679838981323,0.33140263491978544,0.31947746286079326,0.29411411087594663,0.27905203360764796,0.2762130034332507,0.2675156938245815,0.2359914086142253,0.23739478454494037,0.22062980721104034,0.21039339145187974,0.21093214308098443,0.1990377970561429,0.191805899057051,0.18171177988439413,0.1773815445095092,0.16558671241730544,0.15835489810784883,0.1482169954891922,0.15343383877784816,0.14196132295257216,0.14191287137647277,0.12966100164875566,0.13539463500616072,0.12822021175189932,0.12575122007672282,0.0,0.0,0.0,0.0,0.0,0.0,0.0,0.0,0.0,0.0,0.0,0.0,0.0,0.0,0.0,0.0,0.0,0.0,0.0,0.0,0.0,0.0,0.0,0.0,0.0,0.0,0.0,0.0,0.0,0.0,0.0,0.0,0.0,0.0,0.0,0.0,0.0,0.0,0.0,0.0,0.0,0.0,0.0,0.0,0.0,0.0,0.0,0.0,0.0,0.0,0.0,0.0,0.0,0.0,0.0,0.0,0.0,0.0,0.0,0.0,0.0,0.0,0.0,0.0,0.0,0.0,0.0,0.0,0.0,0.0,0.0,0.0,0.0,0.0,0.0,0.0,0.0,0.0,0.0,0.0,0.0,0.0,0.0,0.0,0.0,0.0,0.0,0.0,0.0,0.0,0.0,0.0,0.0,0.0,0.0,0.0,0.0,0.0,0.0,0.0,0.0,0.0,0.0,0.0,0.0,0.0,0.0,0.0,0.0,0.0,0.0,0.0,0.0,0.0,0.0,0.0,0.0,0.0,0.0,0.0,0.0,0.0,0.0,0.0,0.0,0.0,0.0,0.0
"('bouveret', '30.04.2022')",Bouveret,2022-04-30,5,0.043103448275862,Haut lac,0.7302797692049658,0.6999677024452676,0.6057567125840336,0.5352017498503865,0.5264214817367325,0.4340904197719102,0.42523065510491137,0.4122581083916993,0.3793644217936407,0.3500374710334708,0.34649679838981323,0.33140263491978544,0.31947746286079326,0.29411411087594663,0.27905203360764796,0.2762130034332507,0.2675156938245815,0.2359914086142253,0.23739478454494037,0.22062980721104034,0.21039339145187974,0.21093214308098443,0.1990377970561429,0.191805899057051,0.18171177988439413,0.1773815445095092,0.16558671241730544,0.15835489810784883,0.1482169954891922,0.15343383877784816,0.14196132295257216,0.14191287137647277,0.12966100164875566,0.13539463500616072,0.12822021175189932,0.12575122007672282,0.0,0.0,0.0,0.0,0.0,0.0,0.0,0.0,0.0,0.0,0.0,0.0,0.0,0.0,0.0,0.0,0.0,0.0,0.0,0.0,0.0,0.0,0.0,0.0,0.0,0.0,0.0,0.0,0.0,0.0,0.0,0.0,0.0,0.0,0.0,0.0,0.0,0.0,0.0,0.0,0.0,0.0,0.0,0.0,0.0,0.0,0.0,0.0,0.0,0.0,0.0,0.0,0.0,0.0,0.0,0.0,0.0,0.0,0.0,0.0,0.0,0.0,0.0,0.0,0.0,0.0,0.0,0.0,0.0,0.0,0.0,0.0,0.0,0.0,0.0,0.0,0.0,0.0,0.0,0.0,0.0,0.0,0.0,0.0,0.0,0.0,0.0,0.0,0.0,0.0,0.0,0.0,0.0,0.0,0.0,0.0,0.0,0.0,0.0,0.0,0.0,0.0,0.0,0.0,0.0,0.0,0.0,0.0,0.0,0.0,0.0,0.0,0.0,0.0,0.0,0.0,0.0,0.0,0.0,0.0,0.0,0.0,0.0,0.0,0.0,0.0,0.0,0.0
"('clarens', '16.01.2022')",Clarens,2022-01-16,1,0.0192307692307692,Haut lac,0.7302797692049658,0.6999677024452676,0.6057567125840336,0.5352017498503865,0.5264214817367325,0.4340904197719102,0.42523065510491137,0.4122581083916993,0.3793644217936407,0.3500374710334708,0.34649679838981323,0.33140263491978544,0.31947746286079326,0.29411411087594663,0.27905203360764796,0.2762130034332507,0.2675156938245815,0.2359914086142253,0.23739478454494037,0.22062980721104034,0.21039339145187974,0.21093214308098443,0.1990377970561429,0.191805899057051,0.18171177988439413,0.1773815445095092,0.16558671241730544,0.15835489810784883,0.1482169954891922,0.15343383877784816,0.14196132295257216,0.14191287137647277,0.12966100164875566,0.13539463500616072,0.12822021175189932,0.12575122007672282,0.0,0.0,0.0,0.0,0.0,0.0,0.0,0.0,0.0,0.0,0.0,0.0,0.0,0.0,0.0,0.0,0.0,0.0,0.0,0.0,0.0,0.0,0.0,0.0,0.0,0.0,0.0,0.0,0.0,0.0,0.0,0.0,0.0,0.0,0.0,0.0,0.0,0.0,0.0,0.0,0.0,0.0,0.0,0.0,0.0,0.0,0.0,0.0,0.0,0.0,0.0,0.0,0.0,0.0,0.0,0.0,0.0,0.0,0.0,0.0,0.0,0.0,0.0,0.0,0.0,0.0,0.0,0.0,0.0,0.0,0.0,0.0,0.0,0.0,0.0,0.0,0.0,0.0,0.0,0.0,0.0,0.0,0.0,0.0,0.0,0.0,0.0,0.0,0.0,0.0,0.0,0.0,0.0,0.0,0.0,0.0,0.0,0.0,0.0,0.0,0.0,0.0,0.0,0.0,0.0,0.0,0.0,0.0,0.0,0.0,0.0,0.0,0.0,0.0,0.0,0.0,0.0,0.0,0.0,0.0,0.0,0.0,0.0,0.0,0.0,0.0,0.0,0.0
"('clarens', '17.12.2022')",Clarens,2022-12-17,1,0.0192307692307692,Haut lac,0.7302797692049658,0.6999677024452676,0.6057567125840336,0.5352017498503865,0.5264214817367325,0.4340904197719102,0.42523065510491137,0.4122581083916993,0.3793644217936407,0.3500374710334708,0.34649679838981323,0.33140263491978544,0.31947746286079326,0.29411411087594663,0.27905203360764796,0.2762130034332507,0.2675156938245815,0.2359914086142253,0.23739478454494037,0.22062980721104034,0.21039339145187974,0.21093214308098443,0.1990377970561429,0.191805899057051,0.18171177988439413,0.1773815445095092,0.16558671241730544,0.15835489810784883,0.1482169954891922,0.15343383877784816,0.14196132295257216,0.14191287137647277,0.12966100164875566,0.13539463500616072,0.12822021175189932,0.12575122007672282,0.0,0.0,0.0,0.0,0.0,0.0,0.0,0.0,0.0,0.0,0.0,0.0,0.0,0.0,0.0,0.0,0.0,0.0,0.0,0.0,0.0,0.0,0.0,0.0,0.0,0.0,0.0,0.0,0.0,0.0,0.0,0.0,0.0,0.0,0.0,0.0,0.0,0.0,0.0,0.0,0.0,0.0,0.0,0.0,0.0,0.0,0.0,0.0,0.0,0.0,0.0,0.0,0.0,0.0,0.0,0.0,0.0,0.0,0.0,0.0,0.0,0.0,0.0,0.0,0.0,0.0,0.0,0.0,0.0,0.0,0.0,0.0,0.0,0.0,0.0,0.0,0.0,0.0,0.0,0.0,0.0,0.0,0.0,0.0,0.0,0.0,0.0,0.0,0.0,0.0,0.0,0.0,0.0,0.0,0.0,0.0,0.0,0.0,0.0,0.0,0.0,0.0,0.0,0.0,0.0,0.0,0.0,0.0,0.0,0.0,0.0,0.0,0.0,0.0,0.0,0.0,0.0,0.0,0.0,0.0,0.0,0.0,0.0,0.0,0.0,0.0,0.0,0.0
"('clarens', '29.04.2022')",Clarens,2022-04-29,1,0.0192307692307692,Haut lac,0.7302797692049658,0.6999677024452676,0.6057567125840336,0.5352017498503865,0.5264214817367325,0.4340904197719102,0.42523065510491137,0.4122581083916993,0.3793644217936407,0.3500374710334708,0.34649679838981323,0.33140263491978544,0.31947746286079326,0.29411411087594663,0.27905203360764796,0.2762130034332507,0.2675156938245815,0.2359914086142253,0.23739478454494037,0.22062980721104034,0.21039339145187974,0.21093214308098443,0.1990377970561429,0.191805899057051,0.18171177988439413,0.1773815445095092,0.16558671241730544,0.15835489810784883,0.1482169954891922,0.15343383877784816,0.14196132295257216,0.14191287137647277,0.12966100164875566,0.13539463500616072,0.12822021175189932,0.12575122007672282,0.0,0.0,0.0,0.0,0.0,0.0,0.0,0.0,0.0,0.0,0.0,0.0,0.0,0.0,0.0,0.0,0.0,0.0,0.0,0.0,0.0,0.0,0.0,0.0,0.0,0.0,0.0,0.0,0.0,0.0,0.0,0.0,0.0,0.0,0.0,0.0,0.0,0.0,0.0,0.0,0.0,0.0,0.0,0.0,0.0,0.0,0.0,0.0,0.0,0.0,0.0,0.0,0.0,0.0,0.0,0.0,0.0,0.0,0.0,0.0,0.0,0.0,0.0,0.0,0.0,0.0,0.0,0.0,0.0,0.0,0.0,0.0,0.0,0.0,0.0,0.0,0.0,0.0,0.0,0.0,0.0,0.0,0.0,0.0,0.0,0.0,0.0,0.0,0.0,0.0,0.0,0.0,0.0,0.0,0.0,0.0,0.0,0.0,0.0,0.0,0.0,0.0,0.0,0.0,0.0,0.0,0.0,0.0,0.0,0.0,0.0,0.0,0.0,0.0,0.0,0.0,0.0,0.0,0.0,0.0,0.0,0.0,0.0,0.0,0.0,0.0,0.0,0.0
"('clarens', '30.07.2022')",Clarens,2022-07-30,3,0.0576923076923076,Haut lac,0.7302797692049658,0.6999677024452676,0.6057567125840336,0.5352017498503865,0.5264214817367325,0.4340904197719102,0.42523065510491137,0.4122581083916993,0.3793644217936407,0.3500374710334708,0.34649679838981323,0.33140263491978544,0.31947746286079326,0.29411411087594663,0.27905203360764796,0.2762130034332507,0.2675156938245815,0.2359914086142253,0.23739478454494037,0.22062980721104034,0.21039339145187974,0.21093214308098443,0.1990377970561429,0.191805899057051,0.18171177988439413,0.1773815445095092,0.16558671241730544,0.15835489810784883,0.1482169954891922,0.15343383877784816,0.14196132295257216,0.14191287137647277,0.12966100164875566,0.13539463500616072,0.12822021175189932,0.12575122007672282,0.0,0.0,0.0,0.0,0.0,0.0,0.0,0.0,0.0,0.0,0.0,0.0,0.0,0.0,0.0,0.0,0.0,0.0,0.0,0.0,0.0,0.0,0.0,0.0,0.0,0.0,0.0,0.0,0.0,0.0,0.0,0.0,0.0,0.0,0.0,0.0,0.0,0.0,0.0,0.0,0.0,0.0,0.0,0.0,0.0,0.0,0.0,0.0,0.0,0.0,0.0,0.0,0.0,0.0,0.0,0.0,0.0,0.0,0.0,0.0,0.0,0.0,0.0,0.0,0.0,0.0,0.0,0.0,0.0,0.0,0.0,0.0,0.0,0.0,0.0,0.0,0.0,0.0,0.0,0.0,0.0,0.0,0.0,0.0,0.0,0.0,0.0,0.0,0.0,0.0,0.0,0.0,0.0,0.0,0.0,0.0,0.0,0.0,0.0,0.0,0.0,0.0,0.0,0.0,0.0,0.0,0.0,0.0,0.0,0.0,0.0,0.0,0.0,0.0,0.0,0.0,0.0,0.0,0.0,0.0,0.0,0.0,0.0,0.0,0.0,0.0,0.0,0.0
"('excenevex', '06.11.2022')",Excenevex,2022-11-06,1,0.0083333333333333,Grand lac,0.37659768214859385,0.37116540559001904,0.32062289604341765,0.23135208044965797,0.1825787499122583,0.14864064483815642,0.14124995869815873,0.10271449356329329,0.11010605035818469,0.10548186783385015,0.10102493854044224,0.10367743028446792,0.08679076107526087,0.06499205741253355,0.0470223372239593,0.052705288754361715,0.052867925736533386,0.027953068395873557,0.03665653178351209,0.03422791979709275,0.035808143716527095,0.03499386380037143,0.0,0.0,0.0,0.0,0.0,0.0,0.0,0.0,0.0,0.0,0.0,0.0,0.0,0.0,0.0,0.0,0.0,0.0,0.0,0.0,0.0,0.0,0.0,0.0,0.0,0.0,0.0,0.0,0.0,0.0,0.0,0.0,0.0,0.0,0.0,0.0,0.0,0.0,0.0,0.0,0.0,0.0,0.0,0.0,0.0,0.0,0.0,0.0,0.0,0.0,0.0,0.0,0.0,0.0,0.0,0.0,0.0,0.0,0.0,0.0,0.0,0.0,0.0,0.0,0.0,0.0,0.0,0.0,0.0,0.0,0.0,0.0,0.0,0.0,0.0,0.0,0.0,0.0,0.0,0.0,0.0,0.0,0.0,0.0,0.0,0.0,0.0,0.0,0.0,0.0,0.0,0.0,0.0,0.0,0.0,0.0,0.0,0.0,0.0,0.0,0.0,0.0,0.0,0.0,0.0,0.0,0.0,0.0,0.0,0.0,0.0,0.0,0.0,0.0,0.0,0.0,0.0,0.0,0.0,0.0,0.0,0.0,0.0,0.0,0.0,0.0,0.0,0.0,0.0,0.0,0.0,0.0,0.0,0.0,0.0,0.0,0.0,0.0,0.0,0.0,0.0,0.0
"('excenevex', '08.05.2022')",Excenevex,2022-05-08,1,0.0083333333333333,Grand lac,0.37659768214859385,0.37116540559001904,0.32062289604341765,0.23135208044965797,0.1825787499122583,0.14864064483815642,0.14124995869815873,0.10271449356329329,0.11010605035818469,0.10548186783385015,0.10102493854044224,0.10367743028446792,0.08679076107526087,0.06499205741253355,0.0470223372239593,0.052705288754361715,0.052867925736533386,0.027953068395873557,0.03665653178351209,0.03422791979709275,0.035808143716527095,0.03499386380037143,0.0,0.0,0.0,0.0,0.0,0.0,0.0,0.0,0.0,0.0,0.0,0.0,0.0,0.0,0.0,0.0,0.0,0.0,0.0,0.0,0.0,0.0,0.0,0.0,0.0,0.0,0.0,0.0,0.0,0.0,0.0,0.0,0.0,0.0,0.0,0.0,0.0,0.0,0.0,0.0,0.0,0.0,0.0,0.0,0.0,0.0,0.0,0.0,0.0,0.0,0.0,0.0,0.0,0.0,0.0,0.0,0.0,0.0,0.0,0.0,0.0,0.0,0.0,0.0,0.0,0.0,0.0,0.0,0.0,0.0,0.0,0.0,0.0,0.0,0.0,0.0,0.0,0.0,0.0,0.0,0.0,0.0,0.0,0.0,0.0,0.0,0.0,0.0,0.0,0.0,0.0,0.0,0.0,0.0,0.0,0.0,0.0,0.0,0.0,0.0,0.0,0.0,0.0,0.0,0.0,0.0,0.0,0.0,0.0,0.0,0.0,0.0,0.0,0.0,0.0,0.0,0.0,0.0,0.0,0.0,0.0,0.0,0.0,0.0,0.0,0.0,0.0,0.0,0.0,0.0,0.0,0.0,0.0,0.0,0.0,0.0,0.0,0.0,0.0,0.0,0.0,0.0
"('grangettes', '02.05.2022')",Grangettes,2022-05-02,2,0.0303030303030303,Haut lac,0.7302797692049658,0.6999677024452676,0.6057567125840336,0.5352017498503865,0.5264214817367325,0.4340904197719102,0.42523065510491137,0.4122581083916993,0.3793644217936407,0.3500374710334708,0.34649679838981323,0.33140263491978544,0.31947746286079326,0.29411411087594663,0.27905203360764796,0.2762130034332507,0.2675156938245815,0.2359914086142253,0.23739478454494037,0.22062980721104034,0.21039339145187974,0.21093214308098443,0.1990377970561429,0.191805899057051,0.18171177988439413,0.1773815445095092,0.16558671241730544,0.15835489810784883,0.1482169954891922,0.15343383877784816,0.14196132295257216,0.14191287137647277,0.12966100164875566,0.13539463500616072,0.12822021175189932,0.12575122007672282,0.0,0.0,0.0,0.0,0.0,0.0,0.0,0.0,0.0,0.0,0.0,0.0,0.0,0.0,0.0,0.0,0.0,0.0,0.0,0.0,0.0,0.0,0.0,0.0,0.0,0.0,0.0,0.0,0.0,0.0,0.0,0.0,0.0,0.0,0.0,0.0,0.0,0.0,0.0,0.0,0.0,0.0,0.0,0.0,0.0,0.0,0.0,0.0,0.0,0.0,0.0,0.0,0.0,0.0,0.0,0.0,0.0,0.0,0.0,0.0,0.0,0.0,0.0,0.0,0.0,0.0,0.0,0.0,0.0,0.0,0.0,0.0,0.0,0.0,0.0,0.0,0.0,0.0,0.0,0.0,0.0,0.0,0.0,0.0,0.0,0.0,0.0,0.0,0.0,0.0,0.0,0.0,0.0,0.0,0.0,0.0,0.0,0.0,0.0,0.0,0.0,0.0,0.0,0.0,0.0,0.0,0.0,0.0,0.0,0.0,0.0,0.0,0.0,0.0,0.0,0.0,0.0,0.0,0.0,0.0,0.0,0.0,0.0,0.0,0.0,0.0,0.0,0.0
"('grangettes', '08.11.2022')",Grangettes,2022-11-08,6,0.0909090909090909,Haut lac,0.7302797692049658,0.6999677024452676,0.6057567125840336,0.5352017498503865,0.5264214817367325,0.4340904197719102,0.42523065510491137,0.4122581083916993,0.3793644217936407,0.3500374710334708,0.34649679838981323,0.33140263491978544,0.31947746286079326,0.29411411087594663,0.27905203360764796,0.2762130034332507,0.2675156938245815,0.2359914086142253,0.23739478454494037,0.22062980721104034,0.21039339145187974,0.21093214308098443,0.1990377970561429,0.191805899057051,0.18171177988439413,0.1773815445095092,0.16558671241730544,0.15835489810784883,0.1482169954891922,0.15343383877784816,0.14196132295257216,0.14191287137647277,0.12966100164875566,0.13539463500616072,0.12822021175189932,0.12575122007672282,0.0,0.0,0.0,0.0,0.0,0.0,0.0,0.0,0.0,0.0,0.0,0.0,0.0,0.0,0.0,0.0,0.0,0.0,0.0,0.0,0.0,0.0,0.0,0.0,0.0,0.0,0.0,0.0,0.0,0.0,0.0,0.0,0.0,0.0,0.0,0.0,0.0,0.0,0.0,0.0,0.0,0.0,0.0,0.0,0.0,0.0,0.0,0.0,0.0,0.0,0.0,0.0,0.0,0.0,0.0,0.0,0.0,0.0,0.0,0.0,0.0,0.0,0.0,0.0,0.0,0.0,0.0,0.0,0.0,0.0,0.0,0.0,0.0,0.0,0.0,0.0,0.0,0.0,0.0,0.0,0.0,0.0,0.0,0.0,0.0,0.0,0.0,0.0,0.0,0.0,0.0,0.0,0.0,0.0,0.0,0.0,0.0,0.0,0.0,0.0,0.0,0.0,0.0,0.0,0.0,0.0,0.0,0.0,0.0,0.0,0.0,0.0,0.0,0.0,0.0,0.0,0.0,0.0,0.0,0.0,0.0,0.0,0.0,0.0,0.0,0.0,0.0,0.0
"('lugrin', '02.07.2022')",Lugrin,2022-07-02,4,0.0571428571428571,Grand lac,0.37659768214859385,0.37116540559001904,0.32062289604341765,0.23135208044965797,0.1825787499122583,0.14864064483815642,0.14124995869815873,0.10271449356329329,0.11010605035818469,0.10548186783385015,0.10102493854044224,0.10367743028446792,0.08679076107526087,0.06499205741253355,0.0470223372239593,0.052705288754361715,0.052867925736533386,0.027953068395873557,0.03665653178351209,0.03422791979709275,0.035808143716527095,0.03499386380037143,0.0,0.0,0.0,0.0,0.0,0.0,0.0,0.0,0.0,0.0,0.0,0.0,0.0,0.0,0.0,0.0,0.0,0.0,0.0,0.0,0.0,0.0,0.0,0.0,0.0,0.0,0.0,0.0,0.0,0.0,0.0,0.0,0.0,0.0,0.0,0.0,0.0,0.0,0.0,0.0,0.0,0.0,0.0,0.0,0.0,0.0,0.0,0.0,0.0,0.0,0.0,0.0,0.0,0.0,0.0,0.0,0.0,0.0,0.0,0.0,0.0,0.0,0.0,0.0,0.0,0.0,0.0,0.0,0.0,0.0,0.0,0.0,0.0,0.0,0.0,0.0,0.0,0.0,0.0,0.0,0.0,0.0,0.0,0.0,0.0,0.0,0.0,0.0,0.0,0.0,0.0,0.0,0.0,0.0,0.0,0.0,0.0,0.0,0.0,0.0,0.0,0.0,0.0,0.0,0.0,0.0,0.0,0.0,0.0,0.0,0.0,0.0,0.0,0.0,0.0,0.0,0.0,0.0,0.0,0.0,0.0,0.0,0.0,0.0,0.0,0.0,0.0,0.0,0.0,0.0,0.0,0.0,0.0,0.0,0.0,0.0,0.0,0.0,0.0,0.0,0.0,0.0
"('lugrin', '05.11.2022')",Lugrin,2022-11-05,3,0.0428571428571428,Grand lac,0.37659768214859385,0.37116540559001904,0.32062289604341765,0.23135208044965797,0.1825787499122583,0.14864064483815642,0.14124995869815873,0.10271449356329329,0.11010605035818469,0.10548186783385015,0.10102493854044224,0.10367743028446792,0.08679076107526087,0.06499205741253355,0.0470223372239593,0.052705288754361715,0.052867925736533386,0.027953068395873557,0.03665653178351209,0.03422791979709275,0.035808143716527095,0.03499386380037143,0.0,0.0,0.0,0.0,0.0,0.0,0.0,0.0,0.0,0.0,0.0,0.0,0.0,0.0,0.0,0.0,0.0,0.0,0.0,0.0,0.0,0.0,0.0,0.0,0.0,0.0,0.0,0.0,0.0,0.0,0.0,0.0,0.0,0.0,0.0,0.0,0.0,0.0,0.0,0.0,0.0,0.0,0.0,0.0,0.0,0.0,0.0,0.0,0.0,0.0,0.0,0.0,0.0,0.0,0.0,0.0,0.0,0.0,0.0,0.0,0.0,0.0,0.0,0.0,0.0,0.0,0.0,0.0,0.0,0.0,0.0,0.0,0.0,0.0,0.0,0.0,0.0,0.0,0.0,0.0,0.0,0.0,0.0,0.0,0.0,0.0,0.0,0.0,0.0,0.0,0.0,0.0,0.0,0.0,0.0,0.0,0.0,0.0,0.0,0.0,0.0,0.0,0.0,0.0,0.0,0.0,0.0,0.0,0.0,0.0,0.0,0.0,0.0,0.0,0.0,0.0,0.0,0.0,0.0,0.0,0.0,0.0,0.0,0.0,0.0,0.0,0.0,0.0,0.0,0.0,0.0,0.0,0.0,0.0,0.0,0.0,0.0,0.0,0.0,0.0,0.0,0.0
"('lugrin', '07.05.2022')",Lugrin,2022-05-07,2,0.0285714285714285,Grand lac,0.37659768214859385,0.37116540559001904,0.32062289604341765,0.23135208044965797,0.1825787499122583,0.14864064483815642,0.14124995869815873,0.10271449356329329,0.11010605035818469,0.10548186783385015,0.10102493854044224,0.10367743028446792,0.08679076107526087,0.06499205741253355,0.0470223372239593,0.052705288754361715,0.052867925736533386,0.027953068395873557,0.03665653178351209,0.03422791979709275,0.035808143716527095,0.03499386380037143,0.0,0.0,0.0,0.0,0.0,0.0,0.0,0.0,0.0,0.0,0.0,0.0,0.0,0.0,0.0,0.0,0.0,0.0,0.0,0.0,0.0,0.0,0.0,0.0,0.0,0.0,0.0,0.0,0.0,0.0,0.0,0.0,0.0,0.0,0.0,0.0,0.0,0.0,0.0,0.0,0.0,0.0,0.0,0.0,0.0,0.0,0.0,0.0,0.0,0.0,0.0,0.0,0.0,0.0,0.0,0.0,0.0,0.0,0.0,0.0,0.0,0.0,0.0,0.0,0.0,0.0,0.0,0.0,0.0,0.0,0.0,0.0,0.0,0.0,0.0,0.0,0.0,0.0,0.0,0.0,0.0,0.0,0.0,0.0,0.0,0.0,0.0,0.0,0.0,0.0,0.0,0.0,0.0,0.0,0.0,0.0,0.0,0.0,0.0,0.0,0.0,0.0,0.0,0.0,0.0,0.0,0.0,0.0,0.0,0.0,0.0,0.0,0.0,0.0,0.0,0.0,0.0,0.0,0.0,0.0,0.0,0.0,0.0,0.0,0.0,0.0,0.0,0.0,0.0,0.0,0.0,0.0,0.0,0.0,0.0,0.0,0.0,0.0,0.0,0.0,0.0,0.0
"('lutry', '02.11.2022')",Lutry,2022-11-02,4,0.0606060606060606,Grand lac,0.37659768214859385,0.37116540559001904,0.32062289604341765,0.23135208044965797,0.1825787499122583,0.14864064483815642,0.14124995869815873,0.10271449356329329,0.11010605035818469,0.10548186783385015,0.10102493854044224,0.10367743028446792,0.08679076107526087,0.06499205741253355,0.0470223372239593,0.052705288754361715,0.052867925736533386,0.027953068395873557,0.03665653178351209,0.03422791979709275,0.035808143716527095,0.03499386380037143,0.0,0.0,0.0,0.0,0.0,0.0,0.0,0.0,0.0,0.0,0.0,0.0,0.0,0.0,0.0,0.0,0.0,0.0,0.0,0.0,0.0,0.0,0.0,0.0,0.0,0.0,0.0,0.0,0.0,0.0,0.0,0.0,0.0,0.0,0.0,0.0,0.0,0.0,0.0,0.0,0.0,0.0,0.0,0.0,0.0,0.0,0.0,0.0,0.0,0.0,0.0,0.0,0.0,0.0,0.0,0.0,0.0,0.0,0.0,0.0,0.0,0.0,0.0,0.0,0.0,0.0,0.0,0.0,0.0,0.0,0.0,0.0,0.0,0.0,0.0,0.0,0.0,0.0,0.0,0.0,0.0,0.0,0.0,0.0,0.0,0.0,0.0,0.0,0.0,0.0,0.0,0.0,0.0,0.0,0.0,0.0,0.0,0.0,0.0,0.0,0.0,0.0,0.0,0.0,0.0,0.0,0.0,0.0,0.0,0.0,0.0,0.0,0.0,0.0,0.0,0.0,0.0,0.0,0.0,0.0,0.0,0.0,0.0,0.0,0.0,0.0,0.0,0.0,0.0,0.0,0.0,0.0,0.0,0.0,0.0,0.0,0.0,0.0,0.0,0.0,0.0,0.0
"('lutry', '08.09.2022')",Lutry,2022-09-08,4,0.0606060606060606,Grand lac,0.37659768214859385,0.37116540559001904,0.32062289604341765,0.23135208044965797,0.1825787499122583,0.14864064483815642,0.14124995869815873,0.10271449356329329,0.11010605035818469,0.10548186783385015,0.10102493854044224,0.10367743028446792,0.08679076107526087,0.06499205741253355,0.0470223372239593,0.052705288754361715,0.052867925736533386,0.027953068395873557,0.03665653178351209,0.03422791979709275,0.035808143716527095,0.03499386380037143,0.0,0.0,0.0,0.0,0.0,0.0,0.0,0.0,0.0,0.0,0.0,0.0,0.0,0.0,0.0,0.0,0.0,0.0,0.0,0.0,0.0,0.0,0.0,0.0,0.0,0.0,0.0,0.0,0.0,0.0,0.0,0.0,0.0,0.0,0.0,0.0,0.0,0.0,0.0,0.0,0.0,0.0,0.0,0.0,0.0,0.0,0.0,0.0,0.0,0.0,0.0,0.0,0.0,0.0,0.0,0.0,0.0,0.0,0.0,0.0,0.0,0.0,0.0,0.0,0.0,0.0,0.0,0.0,0.0,0.0,0.0,0.0,0.0,0.0,0.0,0.0,0.0,0.0,0.0,0.0,0.0,0.0,0.0,0.0,0.0,0.0,0.0,0.0,0.0,0.0,0.0,0.0,0.0,0.0,0.0,0.0,0.0,0.0,0.0,0.0,0.0,0.0,0.0,0.0,0.0,0.0,0.0,0.0,0.0,0.0,0.0,0.0,0.0,0.0,0.0,0.0,0.0,0.0,0.0,0.0,0.0,0.0,0.0,0.0,0.0,0.0,0.0,0.0,0.0,0.0,0.0,0.0,0.0,0.0,0.0,0.0,0.0,0.0,0.0,0.0,0.0,0.0
"('lutry', '19.05.2022')",Lutry,2022-05-19,6,0.0909090909090909,Grand lac,0.37659768214859385,0.37116540559001904,0.32062289604341765,0.23135208044965797,0.1825787499122583,0.14864064483815642,0.14124995869815873,0.10271449356329329,0.11010605035818469,0.10548186783385015,0.10102493854044224,0.10367743028446792,0.08679076107526087,0.06499205741253355,0.0470223372239593,0.052705288754361715,0.052867925736533386,0.027953068395873557,0.03665653178351209,0.03422791979709275,0.035808143716527095,0.03499386380037143,0.0,0.0,0.0,0.0,0.0,0.0,0.0,0.0,0.0,0.0,0.0,0.0,0.0,0.0,0.0,0.0,0.0,0.0,0.0,0.0,0.0,0.0,0.0,0.0,0.0,0.0,0.0,0.0,0.0,0.0,0.0,0.0,0.0,0.0,0.0,0.0,0.0,0.0,0.0,0.0,0.0,0.0,0.0,0.0,0.0,0.0,0.0,0.0,0.0,0.0,0.0,0.0,0.0,0.0,0.0,0.0,0.0,0.0,0.0,0.0,0.0,0.0,0.0,0.0,0.0,0.0,0.0,0.0,0.0,0.0,0.0,0.0,0.0,0.0,0.0,0.0,0.0,0.0,0.0,0.0,0.0,0.0,0.0,0.0,0.0,0.0,0.0,0.0,0.0,0.0,0.0,0.0,0.0,0.0,0.0,0.0,0.0,0.0,0.0,0.0,0.0,0.0,0.0,0.0,0.0,0.0,0.0,0.0,0.0,0.0,0.0,0.0,0.0,0.0,0.0,0.0,0.0,0.0,0.0,0.0,0.0,0.0,0.0,0.0,0.0,0.0,0.0,0.0,0.0,0.0,0.0,0.0,0.0,0.0,0.0,0.0,0.0,0.0,0.0,0.0,0.0,0.0
"('pichette', '03.02.2022')",Pichette,2022-02-03,1,0.025,Haut lac,0.7302797692049658,0.6999677024452676,0.6057567125840336,0.5352017498503865,0.5264214817367325,0.4340904197719102,0.42523065510491137,0.4122581083916993,0.3793644217936407,0.3500374710334708,0.34649679838981323,0.33140263491978544,0.31947746286079326,0.29411411087594663,0.27905203360764796,0.2762130034332507,0.2675156938245815,0.2359914086142253,0.23739478454494037,0.22062980721104034,0.21039339145187974,0.21093214308098443,0.1990377970561429,0.191805899057051,0.18171177988439413,0.1773815445095092,0.16558671241730544,0.15835489810784883,0.1482169954891922,0.15343383877784816,0.14196132295257216,0.14191287137647277,0.12966100164875566,0.13539463500616072,0.12822021175189932,0.12575122007672282,0.0,0.0,0.0,0.0,0.0,0.0,0.0,0.0,0.0,0.0,0.0,0.0,0.0,0.0,0.0,0.0,0.0,0.0,0.0,0.0,0.0,0.0,0.0,0.0,0.0,0.0,0.0,0.0,0.0,0.0,0.0,0.0,0.0,0.0,0.0,0.0,0.0,0.0,0.0,0.0,0.0,0.0,0.0,0.0,0.0,0.0,0.0,0.0,0.0,0.0,0.0,0.0,0.0,0.0,0.0,0.0,0.0,0.0,0.0,0.0,0.0,0.0,0.0,0.0,0.0,0.0,0.0,0.0,0.0,0.0,0.0,0.0,0.0,0.0,0.0,0.0,0.0,0.0,0.0,0.0,0.0,0.0,0.0,0.0,0.0,0.0,0.0,0.0,0.0,0.0,0.0,0.0,0.0,0.0,0.0,0.0,0.0,0.0,0.0,0.0,0.0,0.0,0.0,0.0,0.0,0.0,0.0,0.0,0.0,0.0,0.0,0.0,0.0,0.0,0.0,0.0,0.0,0.0,0.0,0.0,0.0,0.0,0.0,0.0,0.0,0.0,0.0,0.0
"('port-choiseul', '15.01.2022')",Port Choiseul,2022-01-15,3,0.0384615384615384,Petit lac,0.25088644085149364,0.20109664452740322,0.13525726361383164,0.1406813550505297,0.1417224503310724,0.09234063936990548,0.09048022696667041,0.09470717852014171,0.06669009565900856,0.0766154517928185,0.07115533098049315,0.05300191714918148,0.050309611013413746,0.032958679243266654,0.017286157767884818,0.017316675608425754,0.017725091822240933,0.01727424322099934,0.01686463364967079,0.01643900677596853,0.017709054747084705,0.01805345514388342,0.018459564213096226,0.018217972463836194,0.019539661643931956,0.015341189087781325,0.01742113838867753,0.021351506825431202,0.019169442788193786,0.019791217058523946,0.0,0.0,0.0,0.0,0.0,0.0,0.0,0.0,0.0,0.0,0.0,0.0,0.0,0.0,0.0,0.0,0.0,0.0,0.0,0.0,0.0,0.0,0.0,0.0,0.0,0.0,0.0,0.0,0.0,0.0,0.0,0.0,0.0,0.0,0.0,0.0,0.0,0.0,0.0,0.0,0.0,0.0,0.0,0.0,0.0,0.0,0.0,0.0,0.0,0.0,0.0,0.0,0.0,0.0,0.0,0.0,0.0,0.0,0.0,0.0,0.0,0.0,0.0,0.0,0.0,0.0,0.0,0.0,0.0,0.0,0.0,0.0,0.0,0.0,0.0,0.0,0.0,0.0,0.0,0.0,0.0,0.0,0.0,0.0,0.0,0.0,0.0,0.0,0.0,0.0,0.0,0.0,0.0,0.0,0.0,0.0,0.0,0.0,0.0,0.0,0.0,0.0,0.0,0.0,0.0,0.0,0.0,0.0,0.0,0.0,0.0,0.0,0.0,0.0,0.0,0.0,0.0,0.0,0.0,0.0,0.0,0.0,0.0,0.0,0.0,0.0,0.0,0.0,0.0,0.0,0.0,0.0,0.0,0.0
"('port-choiseul', '16.04.2022')",Port Choiseul,2022-04-16,4,0.0512820512820512,Petit lac,0.25088644085149364,0.20109664452740322,0.13525726361383164,0.1406813550505297,0.1417224503310724,0.09234063936990548,0.09048022696667041,0.09470717852014171,0.06669009565900856,0.0766154517928185,0.07115533098049315,0.05300191714918148,0.050309611013413746,0.032958679243266654,0.017286157767884818,0.017316675608425754,0.017725091822240933,0.01727424322099934,0.01686463364967079,0.01643900677596853,0.017709054747084705,0.01805345514388342,0.018459564213096226,0.018217972463836194,0.019539661643931956,0.015341189087781325,0.01742113838867753,0.021351506825431202,0.019169442788193786,0.019791217058523946,0.0,0.0,0.0,0.0,0.0,0.0,0.0,0.0,0.0,0.0,0.0,0.0,0.0,0.0,0.0,0.0,0.0,0.0,0.0,0.0,0.0,0.0,0.0,0.0,0.0,0.0,0.0,0.0,0.0,0.0,0.0,0.0,0.0,0.0,0.0,0.0,0.0,0.0,0.0,0.0,0.0,0.0,0.0,0.0,0.0,0.0,0.0,0.0,0.0,0.0,0.0,0.0,0.0,0.0,0.0,0.0,0.0,0.0,0.0,0.0,0.0,0.0,0.0,0.0,0.0,0.0,0.0,0.0,0.0,0.0,0.0,0.0,0.0,0.0,0.0,0.0,0.0,0.0,0.0,0.0,0.0,0.0,0.0,0.0,0.0,0.0,0.0,0.0,0.0,0.0,0.0,0.0,0.0,0.0,0.0,0.0,0.0,0.0,0.0,0.0,0.0,0.0,0.0,0.0,0.0,0.0,0.0,0.0,0.0,0.0,0.0,0.0,0.0,0.0,0.0,0.0,0.0,0.0,0.0,0.0,0.0,0.0,0.0,0.0,0.0,0.0,0.0,0.0,0.0,0.0,0.0,0.0,0.0,0.0
"('preverenges', '05.11.2022')",Préverenges,2022-11-05,2,0.016,Grand lac,0.37659768214859385,0.37116540559001904,0.32062289604341765,0.23135208044965797,0.1825787499122583,0.14864064483815642,0.14124995869815873,0.10271449356329329,0.11010605035818469,0.10548186783385015,0.10102493854044224,0.10367743028446792,0.08679076107526087,0.06499205741253355,0.0470223372239593,0.052705288754361715,0.052867925736533386,0.027953068395873557,0.03665653178351209,0.03422791979709275,0.035808143716527095,0.03499386380037143,0.0,0.0,0.0,0.0,0.0,0.0,0.0,0.0,0.0,0.0,0.0,0.0,0.0,0.0,0.0,0.0,0.0,0.0,0.0,0.0,0.0,0.0,0.0,0.0,0.0,0.0,0.0,0.0,0.0,0.0,0.0,0.0,0.0,0.0,0.0,0.0,0.0,0.0,0.0,0.0,0.0,0.0,0.0,0.0,0.0,0.0,0.0,0.0,0.0,0.0,0.0,0.0,0.0,0.0,0.0,0.0,0.0,0.0,0.0,0.0,0.0,0.0,0.0,0.0,0.0,0.0,0.0,0.0,0.0,0.0,0.0,0.0,0.0,0.0,0.0,0.0,0.0,0.0,0.0,0.0,0.0,0.0,0.0,0.0,0.0,0.0,0.0,0.0,0.0,0.0,0.0,0.0,0.0,0.0,0.0,0.0,0.0,0.0,0.0,0.0,0.0,0.0,0.0,0.0,0.0,0.0,0.0,0.0,0.0,0.0,0.0,0.0,0.0,0.0,0.0,0.0,0.0,0.0,0.0,0.0,0.0,0.0,0.0,0.0,0.0,0.0,0.0,0.0,0.0,0.0,0.0,0.0,0.0,0.0,0.0,0.0,0.0,0.0,0.0,0.0,0.0,0.0
"('preverenges', '30.04.2022')",Préverenges,2022-04-30,1,0.008,Grand lac,0.37659768214859385,0.37116540559001904,0.32062289604341765,0.23135208044965797,0.1825787499122583,0.14864064483815642,0.14124995869815873,0.10271449356329329,0.11010605035818469,0.10548186783385015,0.10102493854044224,0.10367743028446792,0.08679076107526087,0.06499205741253355,0.0470223372239593,0.052705288754361715,0.052867925736533386,0.027953068395873557,0.03665653178351209,0.03422791979709275,0.035808143716527095,0.03499386380037143,0.0,0.0,0.0,0.0,0.0,0.0,0.0,0.0,0.0,0.0,0.0,0.0,0.0,0.0,0.0,0.0,0.0,0.0,0.0,0.0,0.0,0.0,0.0,0.0,0.0,0.0,0.0,0.0,0.0,0.0,0.0,0.0,0.0,0.0,0.0,0.0,0.0,0.0,0.0,0.0,0.0,0.0,0.0,0.0,0.0,0.0,0.0,0.0,0.0,0.0,0.0,0.0,0.0,0.0,0.0,0.0,0.0,0.0,0.0,0.0,0.0,0.0,0.0,0.0,0.0,0.0,0.0,0.0,0.0,0.0,0.0,0.0,0.0,0.0,0.0,0.0,0.0,0.0,0.0,0.0,0.0,0.0,0.0,0.0,0.0,0.0,0.0,0.0,0.0,0.0,0.0,0.0,0.0,0.0,0.0,0.0,0.0,0.0,0.0,0.0,0.0,0.0,0.0,0.0,0.0,0.0,0.0,0.0,0.0,0.0,0.0,0.0,0.0,0.0,0.0,0.0,0.0,0.0,0.0,0.0,0.0,0.0,0.0,0.0,0.0,0.0,0.0,0.0,0.0,0.0,0.0,0.0,0.0,0.0,0.0,0.0,0.0,0.0,0.0,0.0,0.0,0.0
"('saint-disdille', '10.09.2022')",Saint-Disdille,2022-09-10,4,0.04,Grand lac,0.37659768214859385,0.37116540559001904,0.32062289604341765,0.23135208044965797,0.1825787499122583,0.14864064483815642,0.14124995869815873,0.10271449356329329,0.11010605035818469,0.10548186783385015,0.10102493854044224,0.10367743028446792,0.08679076107526087,0.06499205741253355,0.0470223372239593,0.052705288754361715,0.052867925736533386,0.027953068395873557,0.03665653178351209,0.03422791979709275,0.035808143716527095,0.03499386380037143,0.0,0.0,0.0,0.0,0.0,0.0,0.0,0.0,0.0,0.0,0.0,0.0,0.0,0.0,0.0,0.0,0.0,0.0,0.0,0.0,0.0,0.0,0.0,0.0,0.0,0.0,0.0,0.0,0.0,0.0,0.0,0.0,0.0,0.0,0.0,0.0,0.0,0.0,0.0,0.0,0.0,0.0,0.0,0.0,0.0,0.0,0.0,0.0,0.0,0.0,0.0,0.0,0.0,0.0,0.0,0.0,0.0,0.0,0.0,0.0,0.0,0.0,0.0,0.0,0.0,0.0,0.0,0.0,0.0,0.0,0.0,0.0,0.0,0.0,0.0,0.0,0.0,0.0,0.0,0.0,0.0,0.0,0.0,0.0,0.0,0.0,0.0,0.0,0.0,0.0,0.0,0.0,0.0,0.0,0.0,0.0,0.0,0.0,0.0,0.0,0.0,0.0,0.0,0.0,0.0,0.0,0.0,0.0,0.0,0.0,0.0,0.0,0.0,0.0,0.0,0.0,0.0,0.0,0.0,0.0,0.0,0.0,0.0,0.0,0.0,0.0,0.0,0.0,0.0,0.0,0.0,0.0,0.0,0.0,0.0,0.0,0.0,0.0,0.0,0.0,0.0,0.0
"('saint-disdille', '22.10.2022')",Saint-Disdille,2022-10-22,2,0.02,Grand lac,0.37659768214859385,0.37116540559001904,0.32062289604341765,0.23135208044965797,0.1825787499122583,0.14864064483815642,0.14124995869815873,0.10271449356329329,0.11010605035818469,0.10548186783385015,0.10102493854044224,0.10367743028446792,0.08679076107526087,0.06499205741253355,0.0470223372239593,0.052705288754361715,0.052867925736533386,0.027953068395873557,0.03665653178351209,0.03422791979709275,0.035808143716527095,0.03499386380037143,0.0,0.0,0.0,0.0,0.0,0.0,0.0,0.0,0.0,0.0,0.0,0.0,0.0,0.0,0.0,0.0,0.0,0.0,0.0,0.0,0.0,0.0,0.0,0.0,0.0,0.0,0.0,0.0,0.0,0.0,0.0,0.0,0.0,0.0,0.0,0.0,0.0,0.0,0.0,0.0,0.0,0.0,0.0,0.0,0.0,0.0,0.0,0.0,0.0,0.0,0.0,0.0,0.0,0.0,0.0,0.0,0.0,0.0,0.0,0.0,0.0,0.0,0.0,0.0,0.0,0.0,0.0,0.0,0.0,0.0,0.0,0.0,0.0,0.0,0.0,0.0,0.0,0.0,0.0,0.0,0.0,0.0,0.0,0.0,0.0,0.0,0.0,0.0,0.0,0.0,0.0,0.0,0.0,0.0,0.0,0.0,0.0,0.0,0.0,0.0,0.0,0.0,0.0,0.0,0.0,0.0,0.0,0.0,0.0,0.0,0.0,0.0,0.0,0.0,0.0,0.0,0.0,0.0,0.0,0.0,0.0,0.0,0.0,0.0,0.0,0.0,0.0,0.0,0.0,0.0,0.0,0.0,0.0,0.0,0.0,0.0,0.0,0.0,0.0,0.0,0.0,0.0
"('saint-disdille', '23.04.2022')",Saint-Disdille,2022-04-23,4,0.04,Grand lac,0.37659768214859385,0.37116540559001904,0.32062289604341765,0.23135208044965797,0.1825787499122583,0.14864064483815642,0.14124995869815873,0.10271449356329329,0.11010605035818469,0.10548186783385015,0.10102493854044224,0.10367743028446792,0.08679076107526087,0.06499205741253355,0.0470223372239593,0.052705288754361715,0.052867925736533386,0.027953068395873557,0.03665653178351209,0.03422791979709275,0.035808143716527095,0.03499386380037143,0.0,0.0,0.0,0.0,0.0,0.0,0.0,0.0,0.0,0.0,0.0,0.0,0.0,0.0,0.0,0.0,0.0,0.0,0.0,0.0,0.0,0.0,0.0,0.0,0.0,0.0,0.0,0.0,0.0,0.0,0.0,0.0,0.0,0.0,0.0,0.0,0.0,0.0,0.0,0.0,0.0,0.0,0.0,0.0,0.0,0.0,0.0,0.0,0.0,0.0,0.0,0.0,0.0,0.0,0.0,0.0,0.0,0.0,0.0,0.0,0.0,0.0,0.0,0.0,0.0,0.0,0.0,0.0,0.0,0.0,0.0,0.0,0.0,0.0,0.0,0.0,0.0,0.0,0.0,0.0,0.0,0.0,0.0,0.0,0.0,0.0,0.0,0.0,0.0,0.0,0.0,0.0,0.0,0.0,0.0,0.0,0.0,0.0,0.0,0.0,0.0,0.0,0.0,0.0,0.0,0.0,0.0,0.0,0.0,0.0,0.0,0.0,0.0,0.0,0.0,0.0,0.0,0.0,0.0,0.0,0.0,0.0,0.0,0.0,0.0,0.0,0.0,0.0,0.0,0.0,0.0,0.0,0.0,0.0,0.0,0.0,0.0,0.0,0.0,0.0,0.0,0.0
"('saint-disdille', '29.01.2022')",Saint-Disdille,2022-01-29,17,0.17,Grand lac,0.37659768214859385,0.37116540559001904,0.32062289604341765,0.23135208044965797,0.1825787499122583,0.14864064483815642,0.14124995869815873,0.10271449356329329,0.11010605035818469,0.10548186783385015,0.10102493854044224,0.10367743028446792,0.08679076107526087,0.06499205741253355,0.0470223372239593,0.052705288754361715,0.052867925736533386,0.027953068395873557,0.03665653178351209,0.03422791979709275,0.035808143716527095,0.03499386380037143,0.0,0.0,0.0,0.0,0.0,0.0,0.0,0.0,0.0,0.0,0.0,0.0,0.0,0.0,0.0,0.0,0.0,0.0,0.0,0.0,0.0,0.0,0.0,0.0,0.0,0.0,0.0,0.0,0.0,0.0,0.0,0.0,0.0,0.0,0.0,0.0,0.0,0.0,0.0,0.0,0.0,0.0,0.0,0.0,0.0,0.0,0.0,0.0,0.0,0.0,0.0,0.0,0.0,0.0,0.0,0.0,0.0,0.0,0.0,0.0,0.0,0.0,0.0,0.0,0.0,0.0,0.0,0.0,0.0,0.0,0.0,0.0,0.0,0.0,0.0,0.0,0.0,0.0,0.0,0.0,0.0,0.0,0.0,0.0,0.0,0.0,0.0,0.0,0.0,0.0,0.0,0.0,0.0,0.0,0.0,0.0,0.0,0.0,0.0,0.0,0.0,0.0,0.0,0.0,0.0,0.0,0.0,0.0,0.0,0.0,0.0,0.0,0.0,0.0,0.0,0.0,0.0,0.0,0.0,0.0,0.0,0.0,0.0,0.0,0.0,0.0,0.0,0.0,0.0,0.0,0.0,0.0,0.0,0.0,0.0,0.0,0.0,0.0,0.0,0.0,0.0,0.0
"('savonniere', '01.05.2022')",Savonnière,2022-05-01,4,0.0727272727272727,Petit lac,0.25088644085149364,0.20109664452740322,0.13525726361383164,0.1406813550505297,0.1417224503310724,0.09234063936990548,0.09048022696667041,0.09470717852014171,0.06669009565900856,0.0766154517928185,0.07115533098049315,0.05300191714918148,0.050309611013413746,0.032958679243266654,0.017286157767884818,0.017316675608425754,0.017725091822240933,0.01727424322099934,0.01686463364967079,0.01643900677596853,0.017709054747084705,0.01805345514388342,0.018459564213096226,0.018217972463836194,0.019539661643931956,0.015341189087781325,0.01742113838867753,0.021351506825431202,0.019169442788193786,0.019791217058523946,0.0,0.0,0.0,0.0,0.0,0.0,0.0,0.0,0.0,0.0,0.0,0.0,0.0,0.0,0.0,0.0,0.0,0.0,0.0,0.0,0.0,0.0,0.0,0.0,0.0,0.0,0.0,0.0,0.0,0.0,0.0,0.0,0.0,0.0,0.0,0.0,0.0,0.0,0.0,0.0,0.0,0.0,0.0,0.0,0.0,0.0,0.0,0.0,0.0,0.0,0.0,0.0,0.0,0.0,0.0,0.0,0.0,0.0,0.0,0.0,0.0,0.0,0.0,0.0,0.0,0.0,0.0,0.0,0.0,0.0,0.0,0.0,0.0,0.0,0.0,0.0,0.0,0.0,0.0,0.0,0.0,0.0,0.0,0.0,0.0,0.0,0.0,0.0,0.0,0.0,0.0,0.0,0.0,0.0,0.0,0.0,0.0,0.0,0.0,0.0,0.0,0.0,0.0,0.0,0.0,0.0,0.0,0.0,0.0,0.0,0.0,0.0,0.0,0.0,0.0,0.0,0.0,0.0,0.0,0.0,0.0,0.0,0.0,0.0,0.0,0.0,0.0,0.0,0.0,0.0,0.0,0.0,0.0,0.0
"('savonniere', '16.01.2022')",Savonnière,2022-01-16,1,0.0181818181818181,Petit lac,0.25088644085149364,0.20109664452740322,0.13525726361383164,0.1406813550505297,0.1417224503310724,0.09234063936990548,0.09048022696667041,0.09470717852014171,0.06669009565900856,0.0766154517928185,0.07115533098049315,0.05300191714918148,0.050309611013413746,0.032958679243266654,0.017286157767884818,0.017316675608425754,0.017725091822240933,0.01727424322099934,0.01686463364967079,0.01643900677596853,0.017709054747084705,0.01805345514388342,0.018459564213096226,0.018217972463836194,0.019539661643931956,0.015341189087781325,0.01742113838867753,0.021351506825431202,0.019169442788193786,0.019791217058523946,0.0,0.0,0.0,0.0,0.0,0.0,0.0,0.0,0.0,0.0,0.0,0.0,0.0,0.0,0.0,0.0,0.0,0.0,0.0,0.0,0.0,0.0,0.0,0.0,0.0,0.0,0.0,0.0,0.0,0.0,0.0,0.0,0.0,0.0,0.0,0.0,0.0,0.0,0.0,0.0,0.0,0.0,0.0,0.0,0.0,0.0,0.0,0.0,0.0,0.0,0.0,0.0,0.0,0.0,0.0,0.0,0.0,0.0,0.0,0.0,0.0,0.0,0.0,0.0,0.0,0.0,0.0,0.0,0.0,0.0,0.0,0.0,0.0,0.0,0.0,0.0,0.0,0.0,0.0,0.0,0.0,0.0,0.0,0.0,0.0,0.0,0.0,0.0,0.0,0.0,0.0,0.0,0.0,0.0,0.0,0.0,0.0,0.0,0.0,0.0,0.0,0.0,0.0,0.0,0.0,0.0,0.0,0.0,0.0,0.0,0.0,0.0,0.0,0.0,0.0,0.0,0.0,0.0,0.0,0.0,0.0,0.0,0.0,0.0,0.0,0.0,0.0,0.0,0.0,0.0,0.0,0.0,0.0,0.0
"('vidy', '04.02.2022')",Vidy,2022-02-04,2,0.028169014084507,Grand lac,0.37659768214859385,0.37116540559001904,0.32062289604341765,0.23135208044965797,0.1825787499122583,0.14864064483815642,0.14124995869815873,0.10271449356329329,0.11010605035818469,0.10548186783385015,0.10102493854044224,0.10367743028446792,0.08679076107526087,0.06499205741253355,0.0470223372239593,0.052705288754361715,0.052867925736533386,0.027953068395873557,0.03665653178351209,0.03422791979709275,0.035808143716527095,0.03499386380037143,0.0,0.0,0.0,0.0,0.0,0.0,0.0,0.0,0.0,0.0,0.0,0.0,0.0,0.0,0.0,0.0,0.0,0.0,0.0,0.0,0.0,0.0,0.0,0.0,0.0,0.0,0.0,0.0,0.0,0.0,0.0,0.0,0.0,0.0,0.0,0.0,0.0,0.0,0.0,0.0,0.0,0.0,0.0,0.0,0.0,0.0,0.0,0.0,0.0,0.0,0.0,0.0,0.0,0.0,0.0,0.0,0.0,0.0,0.0,0.0,0.0,0.0,0.0,0.0,0.0,0.0,0.0,0.0,0.0,0.0,0.0,0.0,0.0,0.0,0.0,0.0,0.0,0.0,0.0,0.0,0.0,0.0,0.0,0.0,0.0,0.0,0.0,0.0,0.0,0.0,0.0,0.0,0.0,0.0,0.0,0.0,0.0,0.0,0.0,0.0,0.0,0.0,0.0,0.0,0.0,0.0,0.0,0.0,0.0,0.0,0.0,0.0,0.0,0.0,0.0,0.0,0.0,0.0,0.0,0.0,0.0,0.0,0.0,0.0,0.0,0.0,0.0,0.0,0.0,0.0,0.0,0.0,0.0,0.0,0.0,0.0,0.0,0.0,0.0,0.0,0.0,0.0
"('vidy', '12.07.2022')",Vidy,2022-07-12,2,0.028169014084507,Grand lac,0.37659768214859385,0.37116540559001904,0.32062289604341765,0.23135208044965797,0.1825787499122583,0.14864064483815642,0.14124995869815873,0.10271449356329329,0.11010605035818469,0.10548186783385015,0.10102493854044224,0.10367743028446792,0.08679076107526087,0.06499205741253355,0.0470223372239593,0.052705288754361715,0.052867925736533386,0.027953068395873557,0.03665653178351209,0.03422791979709275,0.035808143716527095,0.03499386380037143,0.0,0.0,0.0,0.0,0.0,0.0,0.0,0.0,0.0,0.0,0.0,0.0,0.0,0.0,0.0,0.0,0.0,0.0,0.0,0.0,0.0,0.0,0.0,0.0,0.0,0.0,0.0,0.0,0.0,0.0,0.0,0.0,0.0,0.0,0.0,0.0,0.0,0.0,0.0,0.0,0.0,0.0,0.0,0.0,0.0,0.0,0.0,0.0,0.0,0.0,0.0,0.0,0.0,0.0,0.0,0.0,0.0,0.0,0.0,0.0,0.0,0.0,0.0,0.0,0.0,0.0,0.0,0.0,0.0,0.0,0.0,0.0,0.0,0.0,0.0,0.0,0.0,0.0,0.0,0.0,0.0,0.0,0.0,0.0,0.0,0.0,0.0,0.0,0.0,0.0,0.0,0.0,0.0,0.0,0.0,0.0,0.0,0.0,0.0,0.0,0.0,0.0,0.0,0.0,0.0,0.0,0.0,0.0,0.0,0.0,0.0,0.0,0.0,0.0,0.0,0.0,0.0,0.0,0.0,0.0,0.0,0.0,0.0,0.0,0.0,0.0,0.0,0.0,0.0,0.0,0.0,0.0,0.0,0.0,0.0,0.0,0.0,0.0,0.0,0.0,0.0,0.0
"('vidy', '13.05.2022')",Vidy,2022-05-13,1,0.0140845070422535,Grand lac,0.37659768214859385,0.37116540559001904,0.32062289604341765,0.23135208044965797,0.1825787499122583,0.14864064483815642,0.14124995869815873,0.10271449356329329,0.11010605035818469,0.10548186783385015,0.10102493854044224,0.10367743028446792,0.08679076107526087,0.06499205741253355,0.0470223372239593,0.052705288754361715,0.052867925736533386,0.027953068395873557,0.03665653178351209,0.03422791979709275,0.035808143716527095,0.03499386380037143,0.0,0.0,0.0,0.0,0.0,0.0,0.0,0.0,0.0,0.0,0.0,0.0,0.0,0.0,0.0,0.0,0.0,0.0,0.0,0.0,0.0,0.0,0.0,0.0,0.0,0.0,0.0,0.0,0.0,0.0,0.0,0.0,0.0,0.0,0.0,0.0,0.0,0.0,0.0,0.0,0.0,0.0,0.0,0.0,0.0,0.0,0.0,0.0,0.0,0.0,0.0,0.0,0.0,0.0,0.0,0.0,0.0,0.0,0.0,0.0,0.0,0.0,0.0,0.0,0.0,0.0,0.0,0.0,0.0,0.0,0.0,0.0,0.0,0.0,0.0,0.0,0.0,0.0,0.0,0.0,0.0,0.0,0.0,0.0,0.0,0.0,0.0,0.0,0.0,0.0,0.0,0.0,0.0,0.0,0.0,0.0,0.0,0.0,0.0,0.0,0.0,0.0,0.0,0.0,0.0,0.0,0.0,0.0,0.0,0.0,0.0,0.0,0.0,0.0,0.0,0.0,0.0,0.0,0.0,0.0,0.0,0.0,0.0,0.0,0.0,0.0,0.0,0.0,0.0,0.0,0.0,0.0,0.0,0.0,0.0,0.0,0.0,0.0,0.0,0.0,0.0,0.0
"('vidy', '18.10.2022')",Vidy,2022-10-18,1,0.0140845070422535,Grand lac,0.37659768214859385,0.37116540559001904,0.32062289604341765,0.23135208044965797,0.1825787499122583,0.14864064483815642,0.14124995869815873,0.10271449356329329,0.11010605035818469,0.10548186783385015,0.10102493854044224,0.10367743028446792,0.08679076107526087,0.06499205741253355,0.0470223372239593,0.052705288754361715,0.052867925736533386,0.027953068395873557,0.03665653178351209,0.03422791979709275,0.035808143716527095,0.03499386380037143,0.0,0.0,0.0,0.0,0.0,0.0,0.0,0.0,0.0,0.0,0.0,0.0,0.0,0.0,0.0,0.0,0.0,0.0,0.0,0.0,0.0,0.0,0.0,0.0,0.0,0.0,0.0,0.0,0.0,0.0,0.0,0.0,0.0,0.0,0.0,0.0,0.0,0.0,0.0,0.0,0.0,0.0,0.0,0.0,0.0,0.0,0.0,0.0,0.0,0.0,0.0,0.0,0.0,0.0,0.0,0.0,0.0,0.0,0.0,0.0,0.0,0.0,0.0,0.0,0.0,0.0,0.0,0.0,0.0,0.0,0.0,0.0,0.0,0.0,0.0,0.0,0.0,0.0,0.0,0.0,0.0,0.0,0.0,0.0,0.0,0.0,0.0,0.0,0.0,0.0,0.0,0.0,0.0,0.0,0.0,0.0,0.0,0.0,0.0,0.0,0.0,0.0,0.0,0.0,0.0,0.0,0.0,0.0,0.0,0.0,0.0,0.0,0.0,0.0,0.0,0.0,0.0,0.0,0.0,0.0,0.0,0.0,0.0,0.0,0.0,0.0,0.0,0.0,0.0,0.0,0.0,0.0,0.0,0.0,0.0,0.0,0.0,0.0,0.0,0.0,0.0,0.0
